Symbol,Name,Last Sale,Net Change,% Change,Market Cap,Country,IPO Year,Volume,Sector,Industry
PPR,Voya Prime Rate Trust Shares of Beneficial Interest,$4.54,-0.01,-0.22%,555092761.00,United States,,364240,,
PPSI,Pioneer Power Solutions Inc. Common Stock,$8.73,0.23,2.706%,76178373.00,United States,,2264736,Consumer Durables,Electrical Products
PPT,Putnam Premier Income Trust Common Stock,$4.78,0.01,0.21%,490035404.00,United States,1988,207447,,
PPX,PPL Capital Funding Inc. 2013 Series B Junior Subordinated Notes due 2073,$25.37,0.00,0.00%,0.00,,,19506,Public Utilities,Electric Utilities: Central
PQG,PQ Group Holdings Inc. Common Stock,$15.89,0.04,0.252%,2166411503.00,United States,2017,93590,Basic Industries,Major Chemicals
PRA,ProAssurance Corporation Common Stock,$23.60,0.58,2.52%,1271798454.00,United States,,235381,Finance,Property-Casualty Insurers
PRAA,PRA Group Inc. Common Stock,$36.19,-0.11,-0.303%,1649539585.00,United States,2002,130246,Finance,Finance: Consumer Services
PRAH,PRA Health Sciences Inc. Common Stock,$126.90,0.32,0.253%,8140587539.00,United States,2014,218027,Health Care,Biotechnology: Commercial Physical & Biological Resarch
PRAX,Praxis Precision Medicines Inc. Common Stock,$51.08,0.79,1.571%,1954417494.00,United States,2020,27157,Health Care,Major Pharmaceuticals
PRCH,Porch Group Inc. Common Stock,$21.55,-0.81,-3.623%,1755820493.00,United States,2020,2711387,Technology,Computer Software: Prepackaged Software
PRCHW,Porch Group Inc. Warrant,$9.93,-0.82,-7.628%,0.00,United States,2020,353429,Technology,Computer Software: Prepackaged Software
PRDO,Perdoceo Education Corporation Common Stock,$12.50,-0.275,-2.153%,866086988.00,United States,,724585,Consumer Services,Other Consumer Services
PRE^G,PartnerRe Ltd. 6.50% Series G Cumulative Redeemable Preferred Shares $1.00 par value,$25.26,-0.39,-1.52%,,Bermuda,,36155,,
PRE^H,PartnerRe Ltd. 7.25% Series H Cumulative Redeemable Preferred Shares $1.00 par value,$25.26,-0.43,-1.674%,,Bermuda,,70556,,
PRE^I,PartnerRe Ltd. 5.875% Series I Non-Cumulative Redeemable Preferred Shares $1.00 par value,$25.23,-0.30,-1.175%,,Bermuda,,27696,,
PRFT,Perficient Inc. Common Stock,$60.29,-0.34,-0.561%,1990072216.00,United States,1999,302980,Technology,EDP Services
PRFX,PainReform Ltd. Ordinary Shares,$6.38,0.88,16.00%,55876142.00,Israel,2020,844178,Health Care,Major Pharmaceuticals
PRG,PROG Holdings Inc. Common Stock,$50.08,-1.64,-3.171%,3383255461.00,United States,,407297,Technology,Diversified Commercial Services
PRGO,Perrigo Company plc Ordinary Shares,$44.05,-0.33,-0.744%,6012442073.00,United States,,1489040,Health Care,Major Pharmaceuticals
PRGS,Progress Software Corporation Common Stock (DE),$44.15,0.34,0.776%,1952147482.00,United States,1991,280895,Technology,Computer Software: Prepackaged Software
PRGX,PRGX Global Inc. Common Stock,$7.59,-0.01,-0.132%,179365263.00,United States,1996,161880,Consumer Services,Diversified Commercial Services
PRI,Primerica Inc. Common Stock,$142.28,-0.86,-0.601%,5592443737.00,United States,2010,121431,Finance,Life Insurance
PRIF^A,Priority Income Fund Inc. 6.375% Series A Term Preferred Stock due 2025,$24.3775,-0.0025,-0.01%,,,,3361,,
PRIF^B,Priority Income Fund Inc. 6.25% Series B Term Preferred Stock due 2023  par value $0.01 per share,$25.00,-0.20,-0.794%,,,,1600,,
PRIF^C,Priority Income Fund Inc. 6.625% Series C Term Preferred Stock due 2024 par value $0.01 per share,$24.7502,-0.2948,-1.177%,,,,5121,,
PRIF^D,Priority Income Fund Inc. 7.00% Series D Term Preferred Stock due 2029,$24.99,-0.0016,-0.006%,,,,776,,
PRIF^E,Priority Income Fund Inc. 6.375% Series E Preferred Stock Due 2024,$24.4899,0.0599,0.245%,,,,3020,,
PRIF^F,Priority Income Fund Inc. 6.625% Series F Term Preferred Stock due 2027,$24.48,0.00,0.00%,,,,1002,,
PRIM,Primoris Services Corporation Common Stock,$32.07,-0.25,-0.774%,1542448918.00,United States,,309860,Basic Industries,Water Supply
PRLB,Proto Labs Inc. Common stock,$181.48,1.02,0.565%,4859452938.00,United States,2012,537138,Capital Goods,Metal Fabrications
PRLD,Prelude Therapeutics Incorporated Common Stock,$84.36,-1.69,-1.964%,3929352221.00,United States,2020,63596,Health Care,Major Pharmaceuticals
PRMW,Primo Water Corporation Common Stock,$16.23,-0.89,-5.199%,2599998219.00,Canada,,4726709,Consumer Non-Durables,Beverages (Production/Distribution)
PRO,PROS Holdings Inc. Common Stock,$46.01,1.74,3.93%,2035271996.00,United States,2007,760141,Technology,EDP Services
PROF,Profound Medical Corp. Common Stock,$25.34,-1.33,-4.987%,497321674.00,Canada,,96112,Health Care,Medical/Dental Instruments
PROG,Progenity Inc. Common Stock,$5.70,0.04,0.707%,311481795.00,United States,1995,348460,Health Care,Medical Specialities
PROS,ProSight Global Inc. Common Stock,$12.55,0.02,0.16%,547896592.00,United States,2019,79119,Finance,Property-Casualty Insurers
PROV,Provident Financial Holdings Inc. Common Stock,$15.90,0.29,1.858%,118331839.00,United States,,22045,Finance,Savings Institutions
PRPB,CC Neuberger Principal Holdings II Class A Ordinary Shares,$11.05,-0.04,-0.361%,1198925000.00,United States,2020,1055766,Finance,Business Services
PRPH,ProPhase Labs Inc. Common Stock (DE),$10.11,0.04,0.397%,153209498.00,United States,,155086,Health Care,Major Pharmaceuticals
PRPL,Purple Innovation Inc. Common Stock,$38.36,-0.65,-1.666%,2472110200.00,United States,2015,680984,Consumer Durables,Home Furnishings
PRPO,Precipio Inc.  Common Stock,$3.35,-0.37,-9.946%,57710169.00,United States,,852095,Capital Goods,Biotechnology: Laboratory Analytical Instruments
PRQR,ProQR Therapeutics N.V. Ordinary Shares,$5.05,-0.09,-1.751%,253238330.00,Netherlands,2014,446069,Health Care,Major Pharmaceuticals
PRS,Prudential Financial Inc. 5.625% Junior Subordinated Notes due 2058,$26.65,-0.03,-0.112%,907740761.00,United States,2018,20222,Finance,Life Insurance
PRSP,Perspecta Inc. Common Stock ,$29.14,-0.04,-0.137%,4693606230.00,,1998,2051652,Technology,EDP Services
PRSRU,Prospector Capital Corp. Unit,$11.30,-0.1075,-0.942%,0.00,United States,2021,74161,Finance,Business Services
PRT,PermRock Royalty Trust Trust Units,$4.60,0.07,1.545%,55962367.00,United States,2018,38815,Energy,Oil & Gas Production
PRTA,Prothena Corporation plc Ordinary Shares,$24.00,1.00,4.348%,958113912.00,United States,,822824,Health Care,Major Pharmaceuticals
PRTC,PureTech Health plc American Depositary Shares,$58.00,0.00,0.00%,1658212692.00,United Kingdom,,56,Health Care,Major Pharmaceuticals
PRTH,Priority Technology Holdings Inc. Common Stock,$8.47,0.31,3.799%,569349411.00,United States,2016,68737,Miscellaneous,Business Services
PRTK,Paratek Pharmaceuticals Inc. Common Stock,$7.79,-0.38,-4.651%,355544995.00,United States,,367264,Health Care,Major Pharmaceuticals
PRTS,CarParts.com Inc. Common Stock,$19.92,-1.48,-6.916%,942625675.00,United States,2007,1848244,Consumer Services,Other Specialty Stores
PRTY,Party City Holdco Inc. Common Stock,$8.20,-0.25,-2.959%,907298430.00,United States,2015,2790763,Consumer Services,Other Specialty Stores
PRU,Prudential Financial Inc. Common Stock,$83.42,0.66,0.797%,33067688000.00,United States,2001,2051869,Finance,Life Insurance
PRVB,Provention Bio Inc. Common Stock,$14.51,-0.26,-1.76%,910326798.00,United States,2018,489656,Health Care,Major Pharmaceuticals
PS,Pluralsight Inc. Class A Common Stock,$21.52,-0.08,-0.37%,3214266603.00,United States,2018,1401216,Technology,Computer Software: Programming Data Processing
PSA,Public Storage Common Stock,$234.07,4.12,1.792%,40920618778.00,United States,,879036,Consumer Services,Real Estate Investment Trusts
PSA^C,Public Storage Depositary Shares Each Representing 1/1000 of a 5.125% Cumulative Preferred Share of Beneficial Interest Series C,$25.36,0.03,0.118%,,United States,,34639,Consumer Services,Real Estate Investment Trusts
PSA^D,Public Storage Depositary Shares Each Representing 1/1000 of a 4.95% Cumulative Preferred Share of Beneficial Interest Series D,$25.34,0.05,0.198%,,United States,,35933,Consumer Services,Real Estate Investment Trusts
PSA^E,Public Storage Depositary Shares Each Representing 1/1000 of a 4.90% Cumulative Preferred Share of Beneficial Interest Series E,$25.49,0.03,0.118%,,United States,,25744,Consumer Services,Real Estate Investment Trusts
PSA^F,Public Storage Depositary Shares Each Representing 1/1000 of a 5.15% Cumulative Preferred Share of Beneficial Interest Series F par value $0.01 per share,$25.82,-0.01,-0.039%,,United States,,30606,Consumer Services,Real Estate Investment Trusts
PSA^G,Public Storage Depositary Shares Each Representing 1/1000 of a 5.05% Cumulative Preferred Share of Beneficial Interest Series G,$26.05,-0.06,-0.23%,,United States,,13072,,
PSA^H,Public Storage Depositary Shares Each Representing 1/1000 of a  5.60% Cumulative Preferred  Share of Beneficial Interest Series H,$27.36,0.06,0.22%,,United States,,14431,,
PSA^I,Public Storage Depositary Shares Each Representing 1/1000 of a 4.875% Cumulative Preferred Share of Beneficial Interest Series I par value $0.01 per share,$26.25,-0.19,-0.719%,,United States,,78898,,
PSA^J,Public Storage Depositary Shares Each Representing 1/1000 of a 4.700% Cumulative Preferred Share of Beneficial Interest Series J par value $0.01 per share,$25.67,-0.08,-0.311%,,United States,,68176,,
PSA^K,Public Storage Depositary Shares Each Representing 1/1000 of a 4.75% Cumulative Preferred Share of Beneficial Interest Series K,$26.49,-0.0665,-0.25%,,United States,,13658,Consumer Services,Real Estate Investment Trusts
PSA^L,Public Storage Depositary Shares Each Representing 1/1000 of a 4.625% Cumulative Preferred Share of Beneficial Interest Series L par value $0.01 per share,$25.59,0.10,0.392%,,United States,,48470,Consumer Services,Real Estate Investment Trusts
PSA^M,Public Storage Depositary Shares Each Representing 1/1000 of a 4.125% Cumulative Preferred Share of Beneficial Interest Series M,$25.51,-0.11,-0.429%,,United States,,8840,,
PSA^N,Public Storage Depositary Shares Each Representing 1/1000 of a 3.875% Cumulative Preferred Share of Beneficial Interest Series N,$24.74,-0.03,-0.121%,,United States,,63081,,
PSA^O,Public Storage Depositary Shares Each Representing 1/1000 of a 3.900% Cumulative Preferred Share of Beneficial Interest Series O,$25.31,-0.13,-0.511%,,United States,,62246,,
PSAC,Property Solutions Acquisition Corp. Common Stock,$17.82,0.90,5.319%,525984226.00,United States,2020,2491647,Capital Goods,Auto Manufacturing
PSACU,Property Solutions Acquisition Corp. Unit,$22.04,1.32,6.371%,0.00,United States,2020,24666,Capital Goods,Auto Manufacturing
PSACW,Property Solutions Acquisition Corp. Warrant,$4.13,0.26,6.718%,0.00,United States,2020,1156695,Capital Goods,Auto Manufacturing
PSB,PS Business Parks Inc. Common Stock,$144.93,0.01,0.007%,3983915117.00,United States,,68879,Consumer Services,Real Estate Investment Trusts
PSB^W,PS Business Parks Inc. Depositary Shares Each Representing 1/1000 of a Share of 5.20% Cumulative Preferred Stock Series W,$25.50,0.02,0.078%,,United States,,6786,,
PSB^X,PS Business Parks Inc. Depositary Shares Each Representing 1/1000 of a Share of 5.25% Cumulative Preferred Stock Series X,$25.93,-0.03,-0.116%,,United States,,17350,,
PSB^Y,PS Business Parks Inc. 5.20% Cumulative Preferred Stock Series Y,$25.73,0.08,0.312%,,United States,,15918,,
PSB^Z,PS Business Parks Inc. Depositary Shares Each Representing 1/1000 of a Share of 4.875% Cumulative Preferred Stock Series Z  par value $0.01 per share,$25.97,0.09,0.348%,,United States,,36523,,
PSEC,Prospect Capital Corporation Common Stock,$7.31,0.03,0.412%,2819181289.00,United States,2004,2577142,,
PSF,Cohen & Steers Select Preferred and Income Fund Inc. Common Stock,$27.31,-0.03,-0.11%,328062385.00,,2010,7960,,
PSHG,Performance Shipping Inc. Common Shares,$6.96,-0.14,-1.972%,35375773.00,Greece,,217817,Transportation,Marine Transportation
PSMT,PriceSmart Inc. Common Stock,$100.24,0.29,0.29%,3081210600.00,United States,,102935,Consumer Services,Department/Specialty Retail Stores
PSN,Parsons Corporation Common Stock,$39.95,0.56,1.422%,4024048404.00,,2019,364063,Technology,EDP Services
PSNL,Personalis Inc. Common Stock,$39.83,-0.44,-1.093%,1550693623.00,United States,2019,981811,Health Care,Medical Specialities
PSO,Pearson Plc Common Stock,$10.53,-0.24,-2.228%,7936339052.00,United Kingdom,,301794,Consumer Services,Books
PSTG,Pure Storage Inc. Class A Common Stock,$27.66,-0.44,-1.566%,7545951956.00,,2015,5320938,Technology,Electronic Components
PSTH,Pershing Square Tontine Holdings Ltd. Class A Common Stock,$31.95,-1.00,-3.035%,6390003195.00,,2020,6945866,Finance,Business Services
PSTI,Pluristem Therapeutics Inc. Common Stock,$7.56,-0.29,-3.694%,238361259.00,Israel,,452845,Health Care,Biotechnology: Biological Products (No Diagnostic Substances)
PSTL,Postal Realty Trust Inc. Class A Common Stock,$16.41,0.16,0.985%,216842692.00,,2019,22125,Consumer Services,Real Estate Investment Trusts
PSTV,PLUS THERAPEUTICS Inc. Common Stock ,$3.32,-0.18,-5.143%,15868219.00,United States,,744719,Health Care,Medical/Dental Instruments
PSTX,Poseida Therapeutics Inc. Common Stock,$10.62,0.57,5.672%,656528506.00,United States,2020,346735,Health Care,Biotechnology: Biological Products (No Diagnostic Substances)
PSX,Phillips 66 Common Stock,$80.64,1.25,1.575%,35223566918.00,United States,,2134433,Energy,Integrated oil Companies
PSXP,Phillips 66 Partners LP Common Units representing limited partner interest in the Partnership,$26.74,0.13,0.489%,6105815504.00,United States,2013,1198806,Energy,Natural Gas Distribution
PT,Pintec Technology Holdings Limited American Depositary Shares,$2.47,0.24,10.762%,106551492.00,China,2018,5355150,Technology,Computer Software: Programming Data Processing
PTA,Cohen & Steers Tax-Advantaged Preferred Securities and Income Fund Common Shares of Beneficial Interest,$25.23,-0.02,-0.079%,0.00,,2020,55491,,
PTC,PTC Inc. Common Stock,$144.19,-1.94,-1.328%,16842894171.00,United States,,459100,Technology,Computer Software: Prepackaged Software
PTCT,PTC Therapeutics Inc. Common Stock,$59.48,-0.93,-1.539%,4058661756.00,United States,2013,536496,Health Care,Major Pharmaceuticals
PTE,PolarityTE Inc. Common Stock,$1.70,0.10,6.25%,113564797.00,United States,,10373716,Health Care,Biotechnology: Biological Products (No Diagnostic Substances)
PTEN,Patterson-UTI Energy Inc. Common Stock,$6.30,-0.05,-0.787%,1182739452.00,United States,1993,1946317,Energy,Oil & Gas Production
PTGX,Protagonist Therapeutics Inc. Common Stock,$25.45,-1.57,-5.811%,1094825813.00,United States,2016,385421,Health Care,Major Pharmaceuticals
PTIC,PropTech Investment Corporation II Class A Common Stock,$10.42,-0.03,-0.287%,0.00,United States,2021,54607,Finance,Business Services
PTICU,PropTech Investment Corporation II Unit,$11.00,0.08,0.733%,0.00,United States,2020,3441,Finance,Business Services
PTICW,PropTech Investment Corporation II Warrant,$2.12,0.2948,16.152%,0.00,United States,2021,70392,Finance,Business Services
PTMN,Portman Ridge Finance Corporation Common Stock,$2.15,0.06,2.871%,150853095.00,United States,,534491,,
PTNR,Partner Communications Company Ltd. American Depositary Shares,$4.73,-0.015,-0.316%,869002056.00,Israel,,4493,Public Utilities,Telecommunications Equipment
PTON,Peloton Interactive Inc. Class A Common Stock,$139.23,-6.65,-4.559%,41003466818.00,United States,2019,10615285,Energy,Consumer Electronics/Appliances
PTPI,Petros Pharmaceuticals Inc. Common Stock,$4.23,-0.11,-2.535%,41320006.00,United States,,30613,Health Care,Major Pharmaceuticals
PTR,PetroChina Company Limited Common Stock,$35.57,0.47,1.339%,65100561803.00,China,,162003,Energy,Oil & Gas Production
PTRS,Partners Bancorp Common Stock,$7.00,0.10,1.449%,124671491.00,United States,,52739,Finance,Major Banks
PTSI,P.A.M. Transportation Services Inc. Common Stock,$58.51,-0.69,-1.166%,335526297.00,United States,1986,11676,Transportation,Trucking Freight/Courier Services
PTVCA,Protective Insurance Corporation Class A Common Stock,$23.00,0.10,0.437%,328114941.00,United States,,19079,Finance,Property-Casualty Insurers
PTVCB,Protective Insurance Corporation Class B Common Stock,$22.92,0.02,0.087%,326973672.00,United States,,554113,Finance,Property-Casualty Insurers
PTVE,Pactiv Evergreen Inc. Common stock,$16.33,-0.01,-0.061%,2892985404.00,United States,2020,229957,Consumer Durables,Containers/Packaging
PTY,Pimco Corporate & Income Opportunity Fund,$18.03,0.05,0.278%,1914807906.00,United States,2002,325476,,
PUBM,PubMatic Inc. Class A Common Stock,$49.17,-0.84,-1.68%,2351629202.00,United States,2020,326507,Technology,Computer Software: Programming Data Processing
PUCKU,Goal Acquisitions Corp. Unit,$10.58,-0.02,-0.189%,0.00,United States,2021,128322,Finance,Business Services
PUK,Prudential Public Limited Company Common Stock,$38.81,0.08,0.207%,50637693452.00,United Kingdom,,224417,Finance,Life Insurance
PUK^,Prudential Public Limited Company 6.75% Perpetual Subordinated Captial Security,$26.06,-0.34,-1.288%,,United Kingdom,,10982,,
PUK^A,Prudential Public Limited Company 6.50% Perpetual Subordinated Capital Securities Exchangeable at the Issuer's Option Into Non-Cumulative Dollar Denominated Preference Shares,$26.15,-0.20,-0.759%,,United Kingdom,,26814,,
PULM,Pulmatrix Inc. Common Stock,$1.91,-0.20,-9.479%,65718293.00,United States,2014,6553572,Health Care,Major Pharmaceuticals
PUMP,ProPetro Holding Corp. Common Stock,$9.77,-0.13,-1.313%,985917831.00,United States,2017,1012279,Energy,Oilfield Services/Equipment
PUYI,Puyi Inc. American Depository Shares,$6.75,0.3253,5.063%,407124063.00,China,2019,17152,Finance,Investment Managers
PVAC,Penn Virginia Corporation Common Stock,$14.92,1.12,8.116%,564226581.00,United States,,696351,Energy,Oil & Gas Production
PVBC,Provident Bancorp Inc. (MD) Common Stock,$12.35,0.00,0.00%,235237168.00,United States,2015,92806,Finance,Savings Institutions
PVG,Pretium Resources Inc. Ordinary Shares (Canada),$10.63,-0.11,-1.024%,1990507288.00,Canada,,1374086,Basic Industries,Precious Metals
PVH,PVH Corp. Common Stock,$93.45,-4.13,-4.232%,6644318363.00,United States,,1108250,Consumer Non-Durables,Apparel
PVL,Permianville Royalty Trust Trust Units ,$1.80,0.23,14.65%,59400000.00,United States,2011,2107541,Energy,Oil & Gas Production
PWFL,PowerFleet Inc. Common Stock,$7.91,-0.16,-1.983%,276461967.00,United States,,216952,Capital Goods,Telecommunications Equipment
PWOD,Penns Woods Bancorp Inc. Common Stock,$22.94,0.14,0.614%,161780932.00,United States,,8166,Finance,Major Banks
PWR,Quanta Services Inc. Common Stock,$76.83,-0.78,-1.005%,10668682947.00,United States,,604885,Capital Goods,Engineering & Construction
PXD,Pioneer Natural Resources Company Common Stock,$136.20,0.04,0.029%,29447405113.00,United States,,2711081,Energy,Oil & Gas Production
PXLW,Pixelworks Inc.  Common Stock,$3.86,-0.56,-12.67%,196362844.00,United States,2000,1601512,Technology,Semiconductors
PXS,Pyxis Tankers Inc. Common Stock,$2.04,-0.92,-31.081%,43982165.00,Greece,,5654033,Transportation,Marine Transportation
PXSAP,Pyxis Tankers Inc. 7.75% Series A Cumulative Convertible Preferred Shares,$21.475,0.392,1.859%,0.00,Greece,,1702,Transportation,Marine Transportation
PXSAW,Pyxis Tankers Inc. Warrant,$0.55,-0.26,-32.099%,0.00,Greece,,61381,Transportation,Marine Transportation
PYN,PIMCO New York Municipal Income Fund III Common Shares of Beneficial Interest,$9.18,-0.03,-0.326%,52583875.00,United States,2002,8312,,
PYPD,PolyPid Ltd. Ordinary Shares,$14.32,-0.54,-3.634%,264844662.00,Israel,2020,72585,Health Care,Medical/Dental Instruments
PYPL,PayPal Holdings Inc. Common Stock,$297.20,-7.59,-2.49%,348073435872.00,United States,,9867259,Miscellaneous,Business Services
PYS,Merrill Lynch Depositor Inc PPlus Tr Ser RRD-1 Tr Ctf Cl A,$21.70,0.40,1.878%,0.00,United States,,512,Finance,Finance: Consumer Services
PYT,PPlus Tr GSC-2 Tr Ctf Fltg Rate,$24.50,0.00,0.00%,0.00,United States,,606,Finance,Finance: Consumer Services
PZC,PIMCO California Municipal Income Fund III Common Shares of Beneficial Interest,$10.64,-0.13,-1.207%,238056551.00,United States,2002,24692,,
PZN,Pzena Investment Management Inc Class A Common Stock,$9.00,-0.15,-1.639%,640529703.00,United States,2007,53305,Finance,Investment Managers
PZZA,Papa John's International Inc. Common Stock,$100.40,-2.14,-2.087%,3308399274.00,United States,1993,362593,Consumer Services,Restaurants
QADA,QAD Inc. Class A Common Stock,$66.77,-1.63,-2.383%,1382077371.00,United States,,24946,Technology,Computer Software: Prepackaged Software
QADB,QAD Inc. Class B Common Stock,$51.30,0.00,0.00%,1061862650.00,United States,,287,Technology,Computer Software: Prepackaged Software
QCOM,QUALCOMM Incorporated Common Stock,$144.75,-2.41,-1.638%,164436000000.00,United States,1991,11938911,Technology,Radio And Television Broadcasting And Communications Equipment
QCRH,QCR Holdings Inc. Common Stock,$41.11,-0.18,-0.436%,649264906.00,United States,,34539,Finance,Major Banks
QD,Qudian Inc. American Depositary Shares each representing one Class A Ordinary Share,$3.14,-0.52,-14.208%,796710156.00,China,2017,12491996,Finance,Finance: Consumer Services
QDEL,Quidel Corporation Common Stock,$217.79,-4.15,-1.87%,9161912622.00,United States,,389989,Health Care,Biotechnology: In Vitro & In Vivo Diagnostic Substances
QELL,Qell Acquisition Corp. Class A Ordinary Shares,$13.49,0.29,2.197%,639931875.00,United States,2020,737112,Finance,Business Services
QELLU,Qell Acquisition Corp. Unit,$14.65,0.39,2.735%,0.00,United States,2020,119301,Finance,Business Services
QELLW,Qell Acquisition Corp. Warrant,$3.60,-0.01,-0.277%,0.00,United States,2020,199288,Finance,Business Services
QEP,QEP Resources Inc. Common Stock,$3.40,-0.05,-1.449%,824723791.00,United States,,3107150,Energy,Oil & Gas Production
QFIN,360 DigiTech Inc. American Depositary Shares,$26.70,-4.28,-13.815%,4061378332.00,China,2018,5253446,Finance,Finance: Consumer Services
QGEN,Qiagen N.V. Common Shares ,$55.15,-0.06,-0.109%,12573372750.00,Netherlands,,841374,Health Care,Biotechnology: Biological Products (No Diagnostic Substances)
QH,Quhuo Limited American Depository Shares,$8.56,-0.88,-9.322%,444318870.00,China,2020,331104,Miscellaneous,Business Services
QIWI,QIWI plc American Depositary Shares,$11.71,-0.14,-1.181%,734368937.00,Cyprus,2013,604056,Miscellaneous,Business Services
QK,Q&K International Group Limited American Depositary Shares,$3.30,-0.32,-8.84%,178897392.00,China,2019,182409,Finance,Real Estate
QLGN,Qualigen Therapeutics Inc. Common Stock,$4.07,-0.12,-2.864%,108697689.00,United States,2015,1650979,Health Care,Major Pharmaceuticals
QLI,Qilian International Holding Group Ltd. Ordinary Shares,$7.40,-0.02,-0.27%,264550000.00,China,2021,275393,Health Care,Major Pharmaceuticals
QLYS,Qualys Inc. Common Stock,$104.03,0.28,0.27%,4058895962.00,United States,2012,568120,Technology,Computer Software: Prepackaged Software
QMCO,Quantum Corporation Common Stock,$8.40,-0.24,-2.778%,475970939.00,United States,,254723,Technology,Electronic Components
QNST,QuinStreet Inc. Common Stock,$24.19,-0.21,-0.861%,1289242359.00,United States,2010,306482,Miscellaneous,Business Services
QQQX,Nuveen NASDAQ 100 Dynamic Overwrite Fund Shares of Beneficial Interest,$27.18,0.11,0.406%,1113202427.00,United States,,112242,,
QRHC,Quest Resource Holding Corporation Common Stock,$3.22,-0.04,-1.227%,59187551.00,United States,,40345,Technology,Diversified Commercial Services
QRTEA,Qurate Retail Inc. Series A Common Stock ,$13.09,-0.39,-2.893%,5461429291.00,United States,,3079879,Consumer Services,Catalog/Specialty Distribution
QRTEB,Qurate Retail Inc. Series B Common Stock ,$13.13,-0.42,-3.10%,5478118151.00,United States,,2419,Consumer Services,Catalog/Specialty Distribution
QRTEP,Qurate Retail Inc. 8.0% Fixed Rate Cumulative Redeemable Preferred Stock,$100.00,-0.08,-0.08%,0.00,United States,,69356,Consumer Services,Catalog/Specialty Distribution
QRVO,Qorvo Inc. Common Stock,$174.61,-2.42,-1.367%,19776801269.00,United States,,1110853,Technology,Semiconductors
QS,QuantumScape Corporation Class A Common Stock,$66.52,15.88,31.359%,24210639422.00,United States,2020,48797228,Miscellaneous,Industrial Machinery/Components
QSR,Restaurant Brands International Inc. Common Shares,$59.45,0.15,0.253%,18020083248.00,Canada,2014,1687851,Consumer Services,Restaurants
QTNT,Quotient Limited Ordinary Shares,$5.36,-0.02,-0.372%,542074236.00,Switzerland,2014,653523,Health Care,Biotechnology: In Vitro & In Vivo Diagnostic Substances
QTRX,Quanterix Corporation Common Stock,$85.28,-1.98,-2.269%,2715002990.00,United States,2017,280234,Capital Goods,Biotechnology: Laboratory Analytical Instruments
QTS,QTS Realty Trust Inc. Class A Common Stock,$62.80,1.08,1.75%,4046549651.00,United States,2013,1022638,Consumer Services,Real Estate Investment Trusts
QTS^A,QTS Realty Trust Inc. 7.125% Series A Cumulative Redeemable Perpetual Preferred Stock,$26.69,-0.06,-0.224%,,United States,,6867,,
QTS^B,QTS Realty Trust Inc. 6.50% Series B Cumulative Convertible Perpetual Preferred Stock,$140.79,1.21,0.867%,,United States,,29379,,
QTT,Qutoutiao Inc. American Depositary Shares,$4.68,-0.65,-12.195%,1248745923.00,China,2018,10570023,Technology,Computer Software: Programming Data Processing
QTWO,Q2 Holdings Inc. Common Stock,$144.56,-2.14,-1.459%,7789350911.00,,2014,454054,Technology,Computer Software: Prepackaged Software
QUAD,Quad Graphics Inc Class A Common Stock,$5.44,0.09,1.682%,291891414.00,United States,,216798,Miscellaneous,Publishing
QUIK,QuickLogic Corporation Common Stock,$7.17,0.11,1.558%,79360994.00,United States,1999,313691,Technology,Semiconductors
QUMU,Qumu Corporation Common Stock,$9.62,-0.06,-0.62%,168735560.00,United States,,61088,Technology,Computer Software: Prepackaged Software
QUOT,Quotient Technology Inc. Common Stock,$12.03,-0.57,-4.524%,1094796863.00,,2014,882027,Consumer Services,Advertising
QURE,uniQure N.V. Ordinary Shares,$35.00,-1.61,-4.398%,1557364935.00,Netherlands,2014,640708,Health Care,Major Pharmaceuticals
