Symbol,Name,Last Sale,Net Change,% Change,Market Cap,Country,IPO Year,Volume,Sector,Industry
A,Agilent Technologies Inc. Common Stock,$130.12,2.17,1.696%,39737262482.00,United States,1999,4215188,Capital Goods,Biotechnology: Laboratory Analytical Instruments
AA,Alcoa Corporation Common Stock ,$21.93,-0.50,-2.229%,4078499053.00,,2016,4237632,Basic Industries,Aluminum
AACG,ATA Creativity Global American Depositary Shares,$6.02,0.12,2.034%,188730016.00,China,,1580587,Consumer Services,Other Consumer Services
AACQ,Artius Acquisition Inc. Class A Common Stock,$13.50,-0.50,-3.571%,1222593750.00,United States,2020,18587193,Finance,Business Services
AACQU,Artius Acquisition Inc. Unit ,$15.00,-0.34,-2.216%,0.00,United States,2020,1062405,Finance,Business Services
AACQW,Artius Acquisition Inc Warrant,$3.95,-0.02,-0.504%,0.00,United States,2020,3706653,Finance,Business Services
AAIC,Arlington Asset Investment Corp Class A (new),$3.99,-0.07,-1.724%,133376471.00,United States,,219370,Consumer Services,Real Estate Investment Trusts
AAIC^B,Arlington Asset Investment Corp 7.00% ,$22.68,0.00,0.00%,,United States,,11,,
AAIC^C,Arlington Asset Investment Corp 8.250% Seies C Fixed-to-Floating Rate Cumulative Redeemable Preferred Stock   ,$22.585,0.0852,0.379%,,United States,,7318,,
AAL,American Airlines Group Inc. Common Stock,$17.99,0.17,0.954%,11180416601.00,United States,,35476662,Transportation,Air Freight/Delivery Services
AAME,Atlantic American Corporation Common Stock,$5.53,0.15,2.788%,112890963.00,United States,,336157,Finance,Life Insurance
AAN,Aarons Holdings Company Inc. Common Stock ,$20.51,0.25,1.234%,692797220.00,United States,2020,280569,Technology,Diversified Commercial Services
AAOI,Applied Optoelectronics Inc. Common Stock,$12.36,-0.47,-3.663%,283986401.00,United States,2013,422825,Technology,Semiconductors
AAON,AAON Inc. Common Stock,$75.53,-1.28,-1.666%,3945845435.00,United States,,202251,Capital Goods,Industrial Machinery/Components
AAP,Advance Auto Parts Inc Advance Auto Parts Inc W/I,$161.82,6.31,4.058%,10980221501.00,United States,,1590557,Consumer Services,Other Specialty Stores
AAPL,Apple Inc. Common Stock,$130.84,-2.35,-1.764%,2268417565600.00,United States,1980,97937354,Technology,Computer Manufacturing
AAT,American Assets Trust Inc. Common Stock,$29.20,0.01,0.034%,1765866817.00,United States,2011,325676,Consumer Services,Real Estate Investment Trusts
AAWW,Atlas Air Worldwide Holdings NEW Common Stock,$55.95,0.83,1.506%,1539592767.00,United States,,608565,Transportation,Transportation Services
AB,AllianceBernstein Holding L.P.  Units,$38.52,0.15,0.391%,3783547726.00,United States,,721771,Finance,Investment Managers
ABB,ABB Ltd Common Stock,$29.37,-0.37,-1.244%,59645599544.00,Switzerland,,906326,Consumer Durables,Electrical Products
ABBV,AbbVie Inc. Common Stock,$106.29,2.09,2.006%,187652223276.00,United States,2012,6932393,Health Care,Major Pharmaceuticals
ABC,AmerisourceBergen Corporation Common Stock,$105.31,1.94,1.877%,21557604657.00,United States,,896797,Health Care,Other Pharmaceuticals
ABCB,Ameris Bancorp Common Stock,$46.92,0.11,0.235%,3262886289.00,United States,1994,230690,Finance,Major Banks
ABCL,AbCellera Biologics Inc. Common Shares,$45.64,1.60,3.633%,12285729732.00,Canada,2020,607970,Health Care,Major Pharmaceuticals
ABCM,Abcam plc American Depositary Shares,$24.12,0.35,1.472%,5467843530.00,United Kingdom,2020,258596,Health Care,Biotechnology: Biological Products (No Diagnostic Substances)
ABEO,Abeona Therapeutics Inc. Common Stock,$2.63,-0.09,-3.309%,259127911.00,United States,,12360772,Health Care,Major Pharmaceuticals
ABEV,Ambev S.A. American Depositary Shares (Each representing 1 Common Share),$2.87,-0.01,-0.347%,45159185383.00,,2013,26617037,Consumer Non-Durables,Beverages (Production/Distribution)
ABG,Asbury Automotive Group Inc Common Stock,$160.65,3.65,2.325%,3098223286.00,United States,2002,183004,Consumer Durables,Automotive Aftermarket
ABGI,ABG Acquisition Corp. I Class A Ordinary Shares,$10.34,0.34,3.40%,0.00,United States,,4618986,,
ABIO,ARCA biopharma Inc. Common Stock,$4.92,-0.25,-4.836%,45861632.00,United States,,1254539,Health Care,Biotechnology: In Vitro & In Vivo Diagnostic Substances
ABM,ABM Industries Incorporated Common Stock,$41.82,0.44,1.063%,2805221657.00,United States,,168831,Finance,Diversified Commercial Services
ABMD,ABIOMED Inc. Common Stock,$316.30,-6.48,-2.008%,14306554546.00,United States,,349326,Health Care,Medical/Dental Instruments
ABNB,Airbnb Inc. Class A Common Stock,$201.96,-7.90,-3.764%,120448743454.00,United States,2020,4084723,Finance,Diversified Commercial Services
ABR,Arbor Realty Trust Common Stock,$15.47,-0.38,-2.397%,1908922027.00,United States,2004,920126,Consumer Services,Real Estate Investment Trusts
ABR^A,Arbor Realty Trust Preferred Series A,$25.68,0.06,0.234%,,United States,,3880,,
ABR^B,Arbor Realty Trust Cumulative Redeemable Preferred Series B,$25.45,0.0903,0.356%,,United States,,2976,,
ABR^C,Arbor Realty Trust Cumulative Redeemable Preferred Series C,$25.85,-0.10,-0.385%,,United States,,6292,,
ABST,Absolute Software Corporation Common Stock,$15.62,-0.28,-1.761%,767203744.00,Canada,2020,62775,Technology,Computer Software: Prepackaged Software
ABT,Abbott Laboratories Common Stock,$127.24,-0.78,-0.609%,225515287566.00,United States,,3161885,Health Care,Major Pharmaceuticals
ABTX,Allegiance Bancshares Inc. Common Stock,$36.80,0.15,0.409%,752468368.00,United States,2015,33823,Finance,Major Banks
ABUS,Arbutus Biopharma Corporation Common Stock,$4.41,-0.08,-1.782%,374449828.00,Canada,,2041395,Health Care,Major Pharmaceuticals
AC,Associated Capital Group Inc. Common Stock,$35.64,0.12,0.338%,794955403.00,United States,2015,17370,Finance,Investment Bankers/Brokers/Service
ACA,Arcosa Inc. Common Stock ,$64.73,-0.32,-0.492%,3124346536.00,,2018,233504,Capital Goods,Metal Fabrications
ACAC,Acies Acquisition Corp. Class A Ordinary Share,$10.82,0.24,2.268%,291125625.00,United States,2020,577577,Finance,Business Services
ACACU,Acies Acquisition Corp. Unit,$11.67,0.15,1.302%,0.00,United States,2020,38421,Finance,Business Services
ACACW,Acies Acquisition Corp. Warrant,$2.76,0.17,6.564%,0.00,United States,2020,155829,Finance,Business Services
ACAD,ACADIA Pharmaceuticals Inc. Common Stock,$50.07,0.95,1.934%,7960032816.00,United States,2004,792538,Health Care,Major Pharmaceuticals
ACB,Aurora Cannabis Inc. Common Shares,$13.06,-1.03,-7.31%,2577924096.00,,2018,19936467,Consumer Durables,Specialty Chemicals
ACBI,Atlantic Capital Bancshares Inc. Common Stock,$19.475,0.155,0.802%,397190911.00,United States,,73372,Finance,Major Banks
ACC,American Campus Communities Inc Common Stock,$42.85,-0.38,-0.879%,5897535099.00,United States,2004,585779,Consumer Services,Real Estate Investment Trusts
ACCD,Accolade Inc. Common Stock,$51.99,-1.77,-3.292%,2876148096.00,United States,2020,633038,,
ACCO,Acco Brands Corporation Common Stock,$8.43,-0.40,-4.53%,796608336.00,United States,,865610,Consumer Durables,Publishing
ACEL,Accel Entertainment Inc. ,$10.28,-0.43,-4.015%,994927914.00,United States,2017,204229,Consumer Services,Services-Misc. Amusement & Recreation
ACER,Acer Therapeutics Inc. Common Stock (DE),$3.74,-0.07,-1.837%,53520313.00,United States,,197635,Health Care,Major Pharmaceuticals
ACET,Adicet Bio Inc. Common Stock ,$16.11,-0.64,-3.821%,315592129.00,United States,2018,316080,Health Care,Major Pharmaceuticals
ACEV,ACE Convergence Acquisition Corp. Class A Ordinary Shares,$12.88,0.05,0.39%,370300000.00,United States,2020,1186132,Technology,Semiconductors
ACEVU,ACE Convergence Acquisition Corp. Unit,$14.39,-0.14,-0.964%,0.00,United States,2020,8484,Technology,Semiconductors
ACEVW,ACE Convergence Acquisition Corp. Warrant,$3.34,0.16,5.031%,0.00,United States,2020,353187,Technology,Semiconductors
ACGL,Arch Capital Group Ltd. Common Stock,$35.35,0.44,1.26%,14377574695.00,Bermuda,,2272729,Finance,Property-Casualty Insurers
ACGLO,Arch Capital Group Ltd. Depositary Shares Each Representing 1/1000th Interest in a Share of 5.45% Non-Cumulative Preferred Shares Series F,$26.04,0.01,0.038%,0.00,Bermuda,,12353,Finance,Property-Casualty Insurers
ACGLP,Arch Capital Group Ltd. Depositary Shares Representing Interest in 5.25% Non-Cumulative Preferred Series E Shrs,$25.53,0.02,0.078%,0.00,Bermuda,,22916,Finance,Property-Casualty Insurers
ACH,Aluminum Corporation of China Limited American Depositary Shares,$10.29,0.60,6.192%,7006532186.00,China,2001,182590,Basic Industries,Aluminum
ACHC,Acadia Healthcare Company Inc. Common Stock,$51.85,-0.21,-0.403%,4614196416.00,United States,,748833,Health Care,Medical Specialities
ACHV,Achieve Life Sciences Inc. Common Shares,$14.81,-0.35,-2.309%,90195329.00,United States,,99130,Health Care,Biotechnology: In Vitro & In Vivo Diagnostic Substances
ACI,Albertsons Companies Inc. Class A Common Stock,$16.30,-0.17,-1.032%,7588192105.00,United States,2020,2991160,Consumer Services,Food Chains
ACIA,Acacia Communications Inc. Common Stock,$114.82,-0.01,-0.009%,4892298784.00,United States,2016,293128,Technology,Semiconductors
ACIC,Atlas Crest Investment Corp. Class A Common Stock,$16.10,1.96,13.861%,1006250000.00,United States,2020,14961188,Finance,Business Services
ACIU,AC Immune SA Common Stock,$8.96,1.04,13.131%,642801914.00,Switzerland,2016,2384417,Health Care,Major Pharmaceuticals
ACIW,ACI Worldwide Inc. Common Stock,$43.10,1.75,4.232%,5032421986.00,United States,,738926,Technology,Computer Software: Prepackaged Software
ACKIT,Ackrell SPAC Partners I Co. Subunits,$10.2025,-0.0075,-0.073%,0.00,United States,2021,7133,Finance,Business Services
ACKIU,Ackrell SPAC Partners I Co. Units,$10.70,-0.01,-0.093%,0.00,United States,2020,12393,Finance,Business Services
ACKIW,Ackrell SPAC Partners I Co. Warrants,$1.1498,0.0448,4.054%,0.00,United States,2021,317455,Finance,Business Services
ACLS,Axcelis Technologies Inc. Common Stock,$39.54,-0.91,-2.25%,1329848820.00,United States,2000,326540,Technology,Industrial Machinery/Components
ACM,AECOM Common Stock,$56.98,-0.72,-1.248%,8420191979.00,United States,2007,1183928,Consumer Services,Military/Government/Technical
ACMR,ACM Research Inc. Class A Common Stock,$136.47,-3.51,-2.508%,2519894531.00,United States,2017,321958,Technology,Industrial Machinery/Components
ACN,Accenture plc Class A Ordinary Shares (Ireland),$258.78,1.73,0.673%,171224894689.00,Ireland,2001,1902244,Miscellaneous,Business Services
ACNB,ACNB Corporation Common Stock,$27.29,0.29,1.074%,237513412.00,United States,,45102,Finance,Major Banks
ACND,Ascendant Digital Acquisition Corp. Class A Ordinary Shares,$10.92,-0.085,-0.772%,565110000.00,United States,2020,77513,Finance,Business Services
ACOR,Acorda Therapeutics Inc. Common Stock,$7.42,-0.03,-0.403%,70365611.00,United States,2006,215318,Health Care,Biotechnology: Biological Products (No Diagnostic Substances)
ACP,Aberdeen Income Credit Strategies Fund Common Shares,$11.18,-0.10,-0.887%,194890833.00,United States,2011,160050,,
ACR,ACRES Commercial Realty Corp.,$11.65,-1.37,-10.522%,124629079.00,United States,,237149,,
ACR^C,ACRES Commercial Realty Corp.,$24.28,0.00,0.00%,,United States,,8752,,
ACRE,Ares Commercial Real Estate Corporation Common Stock,$13.34,-0.29,-2.128%,446115440.00,United States,2012,423821,Consumer Services,Real Estate Investment Trusts
ACRS,Aclaris Therapeutics Inc. Common Stock,$23.86,-0.07,-0.293%,1205268216.00,United States,2015,490814,Health Care,Major Pharmaceuticals
ACRX,AcelRx Pharmaceuticals Inc. Common Stock,$2.23,-0.07,-3.043%,253798410.00,United States,2011,2911082,Health Care,Major Pharmaceuticals
ACST,Acasti Pharma Inc. Class A Common Stock,$1.02,-0.08,-7.273%,98830388.00,Canada,,35195924,Health Care,Major Pharmaceuticals
ACTC,ArcLight Clean Transition Corp. Class A Ordinary Shares,$24.59,-0.36,-1.443%,852965625.00,United States,2020,1623881,Capital Goods,Auto Manufacturing
ACTCU,ArcLight Clean Transition Corp. Unit,$28.99,0.01,0.035%,0.00,United States,2020,16706,Capital Goods,Auto Manufacturing
ACTCW,ArcLight Clean Transition Corp. Warrant,$8.43,0.38,4.72%,0.00,United States,2020,410985,Capital Goods,Auto Manufacturing
ACTG,Acacia Research Corporation (Acacia Tech) Common Stock,$8.12,0.26,3.308%,400149158.00,United States,,1203385,Miscellaneous,Multi-Sector Companies
ACV,Virtus AllianzGI Diversified Income & Convertible Fund Common Shares of Beneficial Interest,$35.66,-0.24,-0.669%,369220787.00,United States,2015,32683,,
ADAG,Adagene Inc. American Depositary Shares,$25.46,-0.10,-0.391%,1073898217.00,China,2021,142581,Health Care,Major Pharmaceuticals
ADAP,Adaptimmune Therapeutics plc American Depositary Shares,$6.62,-0.15,-2.216%,1024635418.00,United Kingdom,2015,1644428,Health Care,Biotechnology: Biological Products (No Diagnostic Substances)
ADBE,Adobe Inc. Common Stock,$491.23,-10.41,-2.075%,235151801000.00,United States,1986,2113080,Technology,Computer Software: Prepackaged Software
ADC,Agree Realty Corporation Common Stock,$64.45,-0.06,-0.093%,4061734579.00,United States,,517954,Consumer Services,Real Estate Investment Trusts
ADCT,ADC Therapeutics SA Common Shares,$31.57,0.14,0.445%,2422007717.00,,2020,153503,Health Care,Major Pharmaceuticals
ADERU,26 Capital Acquisition Corp. Unit,$10.68,-0.06,-0.559%,0.00,United States,2021,24482,Finance,Business Services
ADES,Advanced Emissions Solutions Inc. Common Stock,$5.92,-0.09,-1.498%,109803491.00,United States,,153890,Basic Industries,Major Chemicals
ADI,Analog Devices Inc. Common Stock,$159.75,-0.74,-0.461%,59012219030.00,United States,,3815876,Technology,Semiconductors
ADIL,Adial Pharmaceuticals Inc Common Stock,$3.11,-0.08,-2.508%,47063879.00,United States,2018,579813,Health Care,Major Pharmaceuticals
ADILW,Adial Pharmaceuticals Inc Warrant,$0.8162,-0.0338,-3.976%,0.00,United States,2018,28222,Health Care,Major Pharmaceuticals
ADM,Archer-Daniels-Midland Company Common Stock,$55.92,-0.13,-0.232%,31097350275.00,United States,,2547093,Consumer Non-Durables,Packaged Foods
ADMA,ADMA Biologics Inc Common Stock,$2.63,-0.02,-0.755%,248661377.00,United States,,3452299,Health Care,Biotechnology: Biological Products (No Diagnostic Substances)
ADMP,Adamis Pharmaceuticals Corporation Common Stock,$1.49,-0.08,-5.096%,209016081.00,United States,,11181103,Health Care,Major Pharmaceuticals
ADMS,Adamas Pharmaceuticals Inc. Common Stock,$5.89,-0.16,-2.645%,167985857.00,United States,2014,1016976,Health Care,Major Pharmaceuticals
ADN,Advent Technologies Holdings Inc. Class A Common Stock,$13.34,-0.88,-6.188%,272645695.00,United States,2018,843751,Miscellaneous,Industrial Machinery/Components
ADNT,Adient plc Ordinary Shares ,$36.44,-0.52,-1.407%,3431558772.00,,2016,443597,Capital Goods,Auto Parts:O.E.M.
ADNWW,Advent Technologies Holdings Inc. Warrant,$2.10,-0.6452,-23.503%,0.00,United States,2018,2124016,Miscellaneous,Industrial Machinery/Components
ADOC,Edoc Acquisition Corp. Class A Ordinary Share,$10.17,-0.03,-0.294%,123479055.00,United States,2020,16929,Finance,Business Services
ADOCR,Edoc Acquisition Corp. Right,$0.6299,0.0299,4.983%,0.00,United States,2020,819,Finance,Business Services
ADOCW,Edoc Acquisition Corp. Warrant,$0.76,0.01,1.333%,0.00,United States,2020,17726,Finance,Business Services
ADP,Automatic Data Processing Inc. Common Stock,$167.13,0.97,0.584%,71521648969.00,United States,,1270932,Technology,EDP Services
ADPT,Adaptive Biotechnologies Corporation Common Stock,$62.12,-2.09,-3.255%,8496302544.00,United States,2019,595578,Health Care,Biotechnology: Biological Products (No Diagnostic Substances)
ADS,Alliance Data Systems Corporation Common Stock,$86.59,-0.52,-0.597%,4296750277.00,United States,2001,495014,Miscellaneous,Business Services
ADSK,Autodesk Inc. Common Stock,$302.52,-5.70,-1.849%,66520942196.00,United States,,890968,Technology,Computer Software: Prepackaged Software
ADT,ADT Inc. Common Stock,$9.41,0.08,0.857%,7767561907.00,United States,2018,5094454,Consumer Services,Diversified Commercial Services
ADTN,ADTRAN Inc. Common Stock,$15.96,-0.20,-1.238%,765381271.00,United States,1994,279828,Public Utilities,Telecommunications Equipment
ADTX,ADiTx Therapeutics Inc. Common Stock,$4.07,-0.44,-9.756%,56873765.00,United States,2020,1386426,Health Care,Major Pharmaceuticals
ADUS,Addus HomeCare Corporation Common Stock,$119.71,-1.78,-1.465%,1892460435.00,United States,2009,61306,Health Care,Medical/Nursing Services
ADV,Advantage Solutions Inc. Class A Common Stock,$10.08,0.08,0.80%,3159325835.00,United States,2019,878105,Miscellaneous,Business Services
ADVM,Adverum Biotechnologies Inc. Common Stock,$13.31,-0.13,-0.967%,1297426896.00,United States,2014,651291,Health Care,Biotechnology: Biological Products (No Diagnostic Substances)
ADVWW,Advantage Solutions Inc. Warrant,$1.90,0.05,2.703%,0.00,United States,2019,63193,Miscellaneous,Business Services
ADX,Adams Diversified Equity Fund Inc.,$18.05,-0.02,-0.111%,1961734865.00,United States,,133462,,
ADXN,Addex Therapeutics Ltd American Depositary Shares,$12.11,0.02,0.165%,68255811.00,Switzerland,,24943,Health Care,Major Pharmaceuticals
ADXS,Advaxis Inc. Common Stock,$1.41,0.28,24.779%,157880080.00,United States,,51039540,Health Care,Major Pharmaceuticals
AEACU,Authentic Equity Acquisition Corp. Unit,$10.46,0.03,0.288%,0.00,United States,2021,39576,Finance,Business Services
AEB,AEGON N.V. Perp. Cap. Secs. Floating Rate (Netherlands),$25.10,0.04,0.16%,0.00,Netherlands,,19893,Finance,Life Insurance
AEE,Ameren Corporation Common Stock,$73.30,0.64,0.881%,18120271487.00,United States,,1487169,Public Utilities,Power Generation
AEFC,Aegon Funding Company LLC 5.10% Subordinated Notes due 2049,$25.69,0.10,0.391%,0.00,,2019,53266,Finance,Life Insurance
AEG,AEGON N.V. Common Stock,$4.63,-0.01,-0.216%,9392044706.00,Netherlands,,1433291,Finance,Life Insurance
AEGN,Aegion Corp Common Stock,$26.00,-0.57,-2.145%,800094152.00,United States,,1196739,Basic Industries,Water Supply
AEHL,Antelope Enterprise Holdings Limited Common Stock (0.024 par),$4.45,0.85,23.611%,13572901.00,China,,4387825,Capital Goods,Building Materials
AEHR,Aehr Test Systems Common Stock,$3.09,-0.17,-5.215%,72588822.00,United States,1997,404817,Capital Goods,Electrical Products
AEI,Alset EHome International Inc. Common Stock,$25.60,-1.90,-6.909%,219392000.00,United States,2020,451768,Finance,Real Estate
AEIS,Advanced Energy Industries Inc. Common Stock,$110.60,-0.40,-0.36%,4232962279.00,United States,1995,296277,Capital Goods,Industrial Machinery/Components
AEL,American Equity Investment Life Holding Company Common Stock,$29.78,-0.16,-0.534%,2954863174.00,United States,2003,311428,Finance,Life Insurance
AEL^A,American Equity Investment Life Holding Company Depositary Shares each representing a 1/1000th interest in a share of 5.95% Fixed-Rate Reset Non-Cumulative Preferred Stock Series A,$26.25,0.23,0.884%,,United States,,26259,,
AEL^B,American Equity Investment Life Holding Company Depositary Shares each representing a 1/1000th interest in a share of 6.625% Fixed-Rate Reset Non-Cumulative Preferred Stock Series B,$27.24,0.40,1.49%,,United States,,48774,,
AEM,Agnico Eagle Mines Limited Common Stock,$61.66,-2.21,-3.46%,14999381202.00,Canada,,1974100,Basic Industries,Precious Metals
AEMD,Aethlon Medical Inc. Common Stock,$2.67,0.06,2.299%,32369809.00,United States,,346014,Health Care,Medical/Dental Instruments
AENZ,Aenza S.A.A. American Depositary Shares,$2.22,-0.06,-2.632%,387131528.00,,2018,28859,Basic Industries,Military/Government/Technical
AEO,American Eagle Outfitters Inc. Common Stock,$24.97,-0.33,-1.304%,4149617177.00,United States,,2041074,Consumer Services,Clothing/Shoe/Accessory Stores
AEP,American Electric Power Company Inc. Common Stock,$78.49,0.30,0.384%,38961614524.00,United States,,2152009,Public Utilities,Electric Utilities: Central
AEPPL,American Electric Power Company Inc. Corporate Unit,$46.65,0.07,0.15%,0.00,United States,,189319,Public Utilities,Electric Utilities: Central
AEPPZ,American Electric Power Company Inc. Corporate Units,$47.28,0.09,0.191%,0.00,United States,,18516,Public Utilities,Electric Utilities: Central
AER,AerCap Holdings N.V. Ordinary Shares,$44.27,0.77,1.77%,5744325258.00,Netherlands,2006,801333,Technology,Diversified Commercial Services
AERI,Aerie Pharmaceuticals Inc. Common Stock,$16.68,-0.27,-1.593%,780870747.00,United States,2013,369689,Health Care,Biotechnology: Biological Products (No Diagnostic Substances)
AES,The AES Corporation Common Stock,$28.76,-0.15,-0.519%,19129171816.00,United States,,4778790,Basic Industries,Electric Utilities: Central
AESE,Allied Esports Entertainment Inc. Common Stock,$2.41,-0.20,-7.663%,94326200.00,United States,2017,2712967,Consumer Services,Services-Misc. Amusement & Recreation
AEY,ADDvantage Technologies Group Inc. Common Stock,$3.46,0.09,2.671%,42788412.00,United States,,240922,Consumer Services,Office Equipment/Supplies/Services
AEYE,AudioEye Inc. Common Stock,$40.05,-0.79,-1.934%,411970080.00,United States,,143923,Technology,Computer Software: Prepackaged Software
AEZS,Aeterna Zentaris Inc. Common Stock,$1.55,-0.26,-14.365%,97151850.00,Canada,,37839999,Health Care,Major Pharmaceuticals
AFB,AllianceBernstein National Municipal Income Fund Inc,$14.48,-0.03,-0.207%,416226673.00,United States,2002,81183,,
AFBI,Affinity Bancshares Inc. Common Stock (MD),$11.06,-0.01,-0.09%,0.00,United States,2017,3445,Finance,Savings Institutions
AFC,Allied Capital Corporation Allied Capital Corporation 6.875% Notes due April 15 2047,$25.84,0.28,1.095%,0.00,United States,,27779,,
AFG,American Financial Group Inc. Common Stock,$107.92,-0.25,-0.231%,9318352400.00,United States,,423558,Finance,Property-Casualty Insurers
AFGB,American Financial Group Inc. 5.875% Subordinated Debentures due 2059,$26.91,-0.10,-0.37%,0.00,United States,2019,11605,Finance,Property-Casualty Insurers
AFGC,American Financial Group Inc. 5.125% Subordinated Debentures due 2059,$26.56,0.01,0.038%,26508474.00,United States,2019,7894,Finance,Property-Casualty Insurers
AFGD,American Financial Group Inc. 5.625% Subordinated Debentures due 2060,$26.88,-0.15,-0.555%,0.00,United States,2020,17855,Finance,Property-Casualty Insurers
AFGE,American Financial Group Inc. 4.500% Subordinated Debentures due 2060,$26.26,-0.06,-0.228%,0.00,United States,2020,3899,Finance,Property-Casualty Insurers
AFI,Armstrong Flooring Inc. Common Stock,$3.77,-0.99,-20.798%,81530857.00,,2016,1007079,Consumer Non-Durables,Plastic Products
AFIB,Acutus Medical Inc. Common Stock,$23.83,-0.41,-1.691%,663572158.00,United States,2020,173165,Health Care,Medical/Dental Instruments
AFIN,American Finance Trust Inc. Class A Common Stock,$8.40,-0.15,-1.754%,914232556.00,United States,,391643,Consumer Services,Real Estate Investment Trusts
AFINO,American Finance Trust Inc. 7.375% Series C Cumulative Redeemable Preferred Stock,$24.94,-0.16,-0.637%,,United States,,2811,Consumer Services,Real Estate Investment Trusts
AFINP,American Finance Trust Inc. 7.50% Series A Cumulative Redeemable Perpetual Preferred Stock,$25.24,-0.045,-0.178%,0.00,United States,,8279,Consumer Services,Real Estate Investment Trusts
AFL,AFLAC Incorporated Common Stock,$47.04,0.69,1.489%,32573036160.00,United States,,3541569,Finance,Accident &Health Insurance
AFMD,Affimed N.V.,$6.25,0.07,1.133%,717414638.00,Germany,2014,1547097,Health Care,Major Pharmaceuticals
AFRM,Affirm Holdings Inc. Class A Common Stock,$112.53,-6.62,-5.556%,27731529841.00,United States,2021,2777825,Miscellaneous,Business Services
AFT,Apollo Senior Floating Rate Fund Inc. Common Stock,$14.61,-0.02,-0.137%,227522421.00,,2011,52058,,
AFYA,Afya Limited Class A Common Shares,$23.47,-0.18,-0.761%,2187470256.00,Brazil,2019,324512,Consumer Services,Other Consumer Services
AG,First Majestic Silver Corp. Ordinary Shares (Canada),$17.42,-0.09,-0.514%,3853960508.00,Canada,,5343087,Basic Industries,Precious Metals
AGBA,AGBA Acquisition Limited Ordinary Share,$10.47,-0.045,-0.428%,62558250.00,Hong Kong,2019,549,Finance,Business Services
AGBAR,AGBA Acquisition Limited Right,$0.52,-0.02,-3.704%,0.00,Hong Kong,2019,6100,Finance,Business Services
AGBAW,AGBA Acquisition Limited Warrant,$0.69,-0.01,-1.429%,0.00,Hong Kong,2019,25885,Finance,Business Services
AGC,Altimeter Growth Corp. Class A Ordinary Shares,$13.90,0.02,0.144%,868750000.00,United States,2020,100320,Finance,Business Services
AGCB,Altimeter Growth Corp. 2 Class A Ordinary Shares,$12.88,-0.23,-1.754%,738668000.00,,2021,185272,Finance,Business Services
AGCO,AGCO Corporation Common Stock,$118.71,1.06,0.901%,8891321070.00,United States,,529863,Capital Goods,Industrial Machinery/Components
AGCUU,Altimeter Growth Corp. Unit,$15.22,-0.02,-0.131%,0.00,United States,2020,29452,Finance,Business Services
AGCWW,Altimeter Growth Corp. Warrant,$4.55,0.20,4.598%,0.00,United States,2020,15438,Finance,Business Services
AGD,Aberdeen Global Dynamic Dividend Fund,$11.19,0.02,0.179%,140429823.00,United States,2006,34691,,
AGEN,Agenus Inc. Common Stock,$4.59,-0.01,-0.217%,872785292.00,United States,2000,1940382,Health Care,Biotechnology: Biological Products (No Diagnostic Substances)
AGFS,AgroFresh Solutions Inc. Common Stock,$2.55,-0.05,-1.923%,135290148.00,United States,2014,109936,Basic Industries,Agricultural Chemicals
AGFY,Agrify Corporation Common Stock,$13.84,-2.17,-13.554%,186726374.00,United States,2021,4202741,Consumer Non-Durables,Farming/Seeds/Milling
AGI,Alamos Gold Inc. Class A Common Shares,$7.90,-0.17,-2.107%,3102548593.00,Canada,2015,3081683,Basic Industries,Precious Metals
AGIO,Agios Pharmaceuticals Inc. Common Stock,$52.50,-1.87,-3.439%,3638452808.00,United States,2013,720199,Health Care,Major Pharmaceuticals
AGLE,Aeglea BioTherapeutics Inc. Common Stock,$7.35,0.08,1.10%,352337736.00,United States,2016,204552,Health Care,Major Pharmaceuticals
AGM,Federal Agricultural Mortgage Corporation Common Stock,$84.00,0.47,0.563%,901823328.00,United States,,44414,Finance,Finance Companies
AGM^C,Federal Agricultural Mortgage Corporation Preferred Series C Fixed to Fltg,$26.81,-0.18,-0.667%,,United States,,833,,
