Symbol,Name,Last Sale,Net Change,% Change,Market Cap,Country,IPO Year,Volume,Sector,Industry
JRSH,Jerash Holdings (US) Inc. Common Stock,$5.97,-0.18,-2.927%,67610250.00,United States,2018,13807,Consumer Non-Durables,Apparel
JRVR,James River Group Holdings Ltd. Common Shares,$50.24,0.18,0.36%,1537854087.00,Bermuda,2014,205903,Finance,Property-Casualty Insurers
JSD,Nuveen Short Duration Credit Opportunities Fund Common Shares of Beneficial Interest,$13.72,0.06,0.439%,138375091.00,United States,2011,51951,,
JSM,Navient Corporation 6% Senior Notes due December 15 2043,$24.02,0.01,0.042%,0.00,United States,,20167,Finance,Finance: Consumer Services
JT,Jianpu Technology Inc. American depositary shares,$3.70,-0.24,-6.091%,78196492.00,,2017,456533,Technology,Computer Software: Programming Data Processing
JTA,Nuveen Tax-Advantaged Total Return Strategy Fund Common Share of Beneficial Interest,$10.10,0.01,0.099%,139894060.00,United States,2004,48455,,
JTD,Nuveen Tax-Advantaged Dividend Growth Fund Common Shares of Beneficial Interest,$14.40,0.02,0.139%,208574496.00,United States,,52322,,
JUPW,Jupiter Wellness Inc. Common Stock,$7.56,0.54,7.692%,69418437.00,United States,2020,1417954,Consumer Non-Durables,Package Goods/Cosmetics
JUPWW,Jupiter Wellness Inc. Warrant,$1.49,0.19,14.615%,0.00,United States,2020,12571,Consumer Non-Durables,Package Goods/Cosmetics
JVA,Coffee Holding Co. Inc. Common Stock,$4.84,-0.43,-8.159%,27629619.00,United States,2005,98468,Consumer Non-Durables,Packaged Foods
JW/A,John Wiley & Sons Inc.,$53.29,0.17,0.32%,,United States,,178755,,
JW/B,John Wiley & Sons Inc.,$52.56,0.00,0.00%,,United States,,1,,
JWN,Nordstrom Inc. Common Stock,$36.05,-0.03,-0.083%,5684490824.00,United States,,2436924,Consumer Services,Clothing/Shoe/Accessory Stores
JWS,Jaws Acquisition Corp. Class A Ordinary Shares,$15.10,-0.37,-2.392%,1302375000.00,,2020,416928,Health Care,Medical/Nursing Services
JYAC,Jiya Acquisition Corp. Class A Common Stock,$10.66,-0.04,-0.374%,146330246.00,United States,2020,18331,Finance,Business Services
JYNT,The Joint Corp. Common Stock,$38.18,0.48,1.273%,536090954.00,United States,2014,166453,Miscellaneous,Multi-Sector Companies
K,Kellogg Company Common Stock,$58.03,1.17,2.058%,19945663997.00,United States,,4342333,Consumer Non-Durables,Packaged Foods
KAI,Kadant Inc Common Stock,$146.73,-0.47,-0.319%,1688797739.00,United States,,25328,Technology,Industrial Machinery/Components
KAIRU,Kairos Acquisition Corp. Unit,$10.50,-0.01,-0.095%,0.00,United States,2021,36604,Finance,Business Services
KALA,Kala Pharmaceuticals Inc. Common Stock,$9.07,-0.41,-4.325%,508462976.00,United States,2017,2431496,Health Care,Major Pharmaceuticals
KALU,Kaiser Aluminum Corporation Common Stock,$111.01,0.11,0.099%,1755308881.00,United States,,84387,Capital Goods,Metal Fabrications
KALV,KalVista Pharmaceuticals Inc. Common Stock,$39.205,-2.895,-6.876%,703422618.00,United Kingdom,2015,662218,Health Care,Major Pharmaceuticals
KAMN,Kaman Corporation Common Stock,$55.11,-0.05,-0.091%,1525301128.00,United States,,47604,Capital Goods,Military/Government/Technical
KAR,KAR Auction Services Inc Common Stock,$15.93,-2.53,-13.705%,2058977223.00,United States,2009,16264643,Consumer Durables,Automotive Aftermarket
KB,KB Financial Group Inc,$40.63,0.26,0.644%,16033993031.00,South Korea,,119134,Finance,Commercial Banks
KBAL,Kimball International Inc. Class B Common Stock,$11.96,-0.11,-0.911%,441107668.00,United States,,344088,Consumer Durables,Home Furnishings
KBH,KB Home Common Stock,$41.25,-0.22,-0.531%,4073936130.00,United States,1986,1429676,Capital Goods,Homebuilding
KBNT,Kubient Inc. Common Stock,$11.83,0.74,6.673%,139074769.00,United States,2020,2039051,Technology,EDP Services
KBNTW,Kubient Inc. Warrant,$6.00,0.80,15.385%,0.00,United States,2020,122255,Technology,EDP Services
KBR,KBR Inc. Common Stock,$31.56,-0.57,-1.774%,4498153793.00,United States,2006,1478011,Basic Industries,Military/Government/Technical
KBSF,KBS Fashion Group Limited Common Stock,$4.98,-0.15,-2.924%,12904669.00,China,2013,108858,Consumer Non-Durables,Apparel
KC,Kingsoft Cloud Holdings Limited American Depositary Shares,$69.34,-0.44,-0.631%,15117351894.00,China,2020,1179401,Technology,Computer Software: Prepackaged Software
KCAPL,KCAP Financial Inc. 6.125% Notes due 2022,$25.53,-0.30,-1.161%,0.00,United States,,763,,
KDMN,Kadmon Holdings Inc. Common Stock,$4.89,0.22,4.711%,838698301.00,United States,,6924219,Health Care,Major Pharmaceuticals
KDNY,Chinook Therapeutics Inc. Common Stock,$16.18,0.82,5.339%,682123430.00,United States,2015,91204,Health Care,Major Pharmaceuticals
KDP,Keurig Dr Pepper Inc. Common Stock,$31.66,0.24,0.764%,44553639288.00,United States,,4298108,Consumer Non-Durables,Beverages (Production/Distribution)
KE,Kimball Electronics Inc. Common Stock,$24.29,-0.19,-0.776%,606207012.00,United States,,112294,Technology,Electrical Products
KELYA,Kelly Services Inc. Class A Common Stock,$20.76,-0.26,-1.237%,815800738.00,United States,,74628,Technology,Professional Services
KELYB,Kelly Services Inc. Class B Common Stock,$20.80,-0.53,-2.485%,817372608.00,United States,,1975,Technology,Professional Services
KEN,Kenon Holdings Ltd. Ordinary Shares,$30.99,-0.2105,-0.675%,1669467217.00,Singapore,2015,6301,Public Utilities,Electric Utilities: Central
KEP,Korea Electric Power Corporation Common Stock,$10.76,0.11,1.033%,13815066937.00,South Korea,1994,103610,Public Utilities,Electric Utilities: Central
KEQU,Kewaunee Scientific Corporation Common Stock,$12.30,-0.27,-2.148%,33982403.00,United States,,2126,Capital Goods,Medical Specialities
KERN,Akerna Corp. Common Stock,$6.73,-0.83,-10.979%,94615098.00,United States,2018,2295833,Technology,EDP Services
KERNW,Akerna Corp Warrant,$2.71,-0.165,-5.739%,0.00,United States,2018,103112,Technology,EDP Services
KEX,Kirby Corporation Common Stock,$60.59,-0.40,-0.656%,3637763010.00,United States,,288107,Consumer Services,Marine Transportation
KEY,KeyCorp Common Stock,$19.72,-0.07,-0.354%,19242243560.00,United States,,6683683,Finance,Major Banks
KEY^I,KeyCorp Depositary Shares Each Representing a 1/40th Ownership Interest in a Share of Fixed-to-Floating Rate Perpetual Non-Cumulative Preferred Stock Series E,$28.01,0.16,0.575%,,United States,,45243,,
KEY^J,KeyCorp Depositary Shares each representing a 1/40th ownership interest in a share of Fixed Rate Perpetual Non-Cumulative Preferred Stock Series F,$26.64,0.24,0.909%,,United States,,17570,,
KEY^K,KeyCorp Depositary Shares each representing a 1/40th ownership interest in a share of Fixed Rate Perpetual Non-Cumulative Preferred Stock Series G,$27.02,0.15,0.558%,,United States,,36918,,
KEYS,Keysight Technologies Inc. Common Stock,$149.06,-2.01,-1.331%,27737759297.00,United States,2014,1002451,Capital Goods,Industrial Machinery/Components
KF,Korea Fund Inc. (The) New Common Stock,$43.8999,-0.1401,-0.318%,220870011.00,United States,,13958,,
KFFB,Kentucky First Federal Bancorp Common Stock,$7.63,0.33,4.521%,62846135.00,United States,,58090,Finance,Savings Institutions
KFRC,Kforce Inc. Common Stock,$47.70,1.20,2.581%,1047304921.00,United States,1995,121714,Technology,Professional Services
KFS,Kingsway Financial Services Inc. Common Stock (DE),$4.69,0.07,1.515%,106514914.00,Canada,,5767,Finance,Property-Casualty Insurers
KFY,Korn Ferry Common Stock,$56.18,0.24,0.429%,3030231896.00,United States,1999,281773,Technology,Diversified Commercial Services
KGC,Kinross Gold Corporation Common Stock,$6.85,-0.22,-3.112%,8620040000.00,Canada,,22485570,Basic Industries,Precious Metals
KHC,The Kraft Heinz Company Common Stock,$37.02,1.66,4.695%,45261509679.00,United States,,10642178,Consumer Non-Durables,Packaged Foods
KIDS,OrthoPediatrics Corp. Common Stock,$51.87,-0.25,-0.48%,1014298191.00,United States,2017,89917,Health Care,Medical/Dental Instruments
KIM,Kimco Realty Corporation Common Stock,$17.81,0.18,1.021%,7703158813.00,United States,,3877384,Consumer Services,Real Estate Investment Trusts
KIM^L,Kimco Realty Corporation Class L Depositary Shares each of which represents a one-one thousandth fractional interest in a share of 5.125% Class L Cumulative Redeemable Preferred Stock liquidation preference $25000.00 per share,$25.45,-0.27,-1.05%,,United States,,77523,,
KIM^M,Kimco Realty Corporation Class M Depositary Shares each of which represents a one-one thousandth fractional interest in a share of 5.25% Class M Cumulative Redeemable Preferred Stock liquidation preference $25000.00 per share,$25.87,-0.15,-0.576%,,United States,,61047,,
KIN,Kindred Biosciences Inc. Common Stock,$5.11,-0.17,-3.22%,201804805.00,United States,2013,334689,Health Care,Major Pharmaceuticals
KINS,Kingstone Companies Inc. Common Stock,$7.37,0.01,0.136%,78676209.00,United States,,5386,Finance,Property-Casualty Insurers
KINZ,KINS Technology Group Inc. Class A Common Stock,$10.32,0.07,0.683%,356040000.00,United States,2021,44950,Finance,Business Services
KINZU,KINS Technology Group Inc. Unit,$11.09,0.06,0.544%,0.00,United States,2020,36887,Finance,Business Services
KINZW,KINS Technology Group Inc. Warrant,$1.68,-0.02,-1.176%,0.00,United States,2021,103889,Finance,Business Services
KIO,KKR Income Opportunities Fund Common Shares,$15.27,0.05,0.329%,310596610.00,,2013,94038,,
KIRK,Kirkland's Inc. COMMONSTOCK,$24.45,-0.36,-1.451%,348549322.00,United States,2002,409465,Consumer Services,Other Specialty Stores
KKR,KKR & Co. Inc. Common Stock,$47.55,-0.40,-0.834%,27241097242.00,United States,,1952424,Finance,Investment Managers
KKR^A,KKR & Co. Inc. 6.75% Series A Preferred Stock,$25.72,0.02,0.078%,,United States,,21665,,
KKR^B,KKR & Co. Inc. 6.50% Series B Preferred Stock,$25.74,-0.03,-0.116%,,United States,,6564,,
KKR^C,KKR & Co. Inc. 6.00% Series C Mandatory Convertible Preferred Stock,$66.52,-0.68,-1.012%,,United States,,11886,,
KL,Kirkland Lake Gold Ltd. Common Shares,$36.07,-0.98,-2.645%,9631547636.00,,,2869806,Basic Industries,Precious Metals
KLAC,KLA Corporation Common Stock,$330.30,-6.88,-2.04%,50890857225.00,United States,1980,1062837,Capital Goods,Electronic Components
KLAQU,KL Acquisition Corp Unit,$10.47,-0.07,-0.664%,0.00,United States,2021,222112,Finance,Business Services
KLDO,Kaleido Biosciences Inc. Common Stock,$11.33,-0.41,-3.492%,473972501.00,United States,2019,206305,Health Care,Biotechnology: Biological Products (No Diagnostic Substances)
KLIC,Kulicke and Soffa Industries Inc. Common Stock,$52.15,1.12,2.195%,3237314872.00,Singapore,,1981835,Technology,Semiconductors
KLXE,KLX Energy Services Holdings Inc. Common Stock,$13.18,-0.41,-3.017%,112163355.00,United States,,50329,Energy,Oilfield Services/Equipment
KMB,Kimberly-Clark Corporation Common Stock,$130.77,0.53,0.407%,44247850341.00,United States,,1770428,Consumer Durables,Containers/Packaging
KMDA,Kamada Ltd. Ordinary Shares,$7.00,0.00,0.00%,313200741.00,Israel,2013,150802,Health Care,Major Pharmaceuticals
KMF,Kayne Anderson NextGen Energy & Infrastructure Inc.,$6.41,-0.04,-0.62%,302535731.00,,2010,198384,,
KMI,Kinder Morgan Inc. Common Stock,$15.13,0.09,0.598%,34261131829.00,United States,2011,13995510,Public Utilities,Natural Gas Distribution
KMPH,KemPharm Inc. Common Stock,$10.54,-0.35,-3.214%,198678821.00,United States,,2461182,Health Care,Major Pharmaceuticals
KMPR,Kemper Corporation,$75.00,0.81,1.092%,4909101375.00,United States,,223684,Finance,Property-Casualty Insurers
KMT,Kennametal Inc. Common Stock,$37.08,-0.89,-2.344%,3097403751.00,United States,,416512,Capital Goods,Industrial Machinery/Components
KMX,CarMax Inc,$122.51,0.15,0.123%,19912953162.00,United States,,927287,Consumer Durables,Automotive Aftermarket
KN,Knowles Corporation Common Stock,$20.75,-0.24,-1.143%,1903322281.00,,2014,368161,Consumer Non-Durables,Consumer Electronics/Appliances
KNDI,Kandi Technologies Group Inc Common Stock,$8.55,-0.40,-4.469%,618828095.00,China,,3661798,Capital Goods,Auto Manufacturing
KNL,Knoll Inc. Common Stock,$15.78,-0.12,-0.755%,799762796.00,United States,2004,279521,Consumer Durables,Office Equipment/Supplies/Services
KNOP,KNOT Offshore Partners LP Common Units representing Limited Partner Interests,$17.07,-0.02,-0.117%,558088185.00,United Kingdom,2013,131916,Consumer Services,Marine Transportation
KNSA,Kiniksa Pharmaceuticals Ltd. Class A Common Stock,$22.52,0.66,3.019%,1533049788.00,United States,2018,359658,Health Care,Major Pharmaceuticals
KNSL,Kinsale Capital Group Inc. Common Stock,$190.72,-2.21,-1.145%,4324973270.00,United States,2016,152447,Finance,Property-Casualty Insurers
KNTE,Kinnate Biopharma Inc. Common Stock,$35.12,-0.04,-0.114%,1521651931.00,United States,2020,184146,Health Care,Major Pharmaceuticals
KNX,Knight-Swift Transportation Holdings Inc.,$42.93,0.21,0.492%,7290867883.00,United States,2017,1097127,Transportation,Trucking Freight/Courier Services
KO,Coca-Cola Company (The) Common Stock,$50.13,-0.14,-0.278%,215659260000.00,United States,,12808246,Consumer Non-Durables,Beverages (Production/Distribution)
KOD,Kodiak Sciences Inc Common Stock,$138.08,-7.50,-5.152%,7011104376.00,United States,2018,565205,Health Care,Biotechnology: Biological Products (No Diagnostic Substances)
KODK,Eastman Kodak Company Common New,$9.93,-0.37,-3.592%,766231827.00,United States,,4874752,Miscellaneous,Industrial Machinery/Components
KOF,Coca Cola Femsa S.A.B. de C.V.  American Depositary Shares each representing 10 Units (each Unit consists of 3 Series B Shares and 5 Series L Shares),$45.47,0.18,0.397%,9552484286.00,Mexico,1993,146560,Consumer Non-Durables,Beverages (Production/Distribution)
KOP,Koppers Holdings Inc. Koppers Holdings Inc. Common Stock,$35.34,-0.08,-0.226%,744451837.00,United States,2006,78928,Basic Industries,Forest Products
KOPN,Kopin Corporation Common Stock,$12.005,-1.555,-11.468%,1021061745.00,United States,1992,8563515,Technology,Semiconductors
KOR,Corvus Gold Inc. Common Shares,$2.31,-0.02,-0.858%,292521872.00,Canada,,205968,Basic Industries,Precious Metals
KOS,Kosmos Energy Ltd. Common Shares (DE),$2.92,0.00,0.00%,1183928740.00,Bermuda,2011,5053022,Energy,Oil & Gas Production
KOSS,Koss Corporation Common Stock,$13.39,-1.11,-7.655%,112414044.00,United States,,535523,Consumer Non-Durables,Consumer Electronics/Appliances
KPTI,Karyopharm Therapeutics Inc. Common Stock,$15.05,0.01,0.066%,1112541150.00,United States,2013,3068390,Health Care,Major Pharmaceuticals
KR,Kroger Company (The) Common Stock,$34.37,0.71,2.109%,26167498452.00,United States,,7077326,Consumer Services,Food Chains
KRA,Kraton Corporation Common Stock,$37.22,0.03,0.081%,1186271932.00,United States,2009,151572,Basic Industries,Major Chemicals
KRBP,Kiromic BioPharma Inc. Common Stock,$10.15,0.37,3.783%,74429940.00,United States,2020,27501,Health Care,Biotechnology: Biological Products (No Diagnostic Substances)
KRC,Kilroy Realty Corporation Common Stock,$59.22,-0.30,-0.504%,6891377865.00,United States,1997,592417,Consumer Services,Real Estate Investment Trusts
KREF,KKR Real Estate Finance Trust Inc. Common Stock,$18.43,-0.48,-2.538%,1025066058.00,United States,2017,212273,Consumer Services,Real Estate Investment Trusts
KRG,Kite Realty Group Trust Common Stock,$18.31,0.19,1.049%,1541482262.00,United States,2004,613186,Consumer Services,Real Estate Investment Trusts
KRKR,36Kr Holdings Inc. American Depositary Shares,$4.64,-0.41,-8.119%,173973738.00,China,2019,388802,Miscellaneous,Business Services
KRMD,Repro Med Systems Inc. Common Stock,$4.70,0.30,6.818%,206531574.00,United States,,1879771,Health Care,Medical/Dental Instruments
KRNLU,Kernel Group Holdings Inc. Units,$10.37,-0.01,-0.096%,0.00,United States,2021,81953,Finance,Business Services
KRNT,Kornit Digital Ltd. Ordinary Shares,$116.85,19.36,19.858%,5290725887.00,Israel,2015,1515514,Capital Goods,Industrial Machinery/Components
KRNY,Kearny Financial Corp Common Stock,$10.73,-0.04,-0.371%,903468801.00,United States,,301226,Finance,Savings Institutions
KRO,Kronos Worldwide Inc Common Stock,$14.23,-0.49,-3.329%,1644172863.00,United States,,150820,Basic Industries,Major Chemicals
KRON,Kronos Bio Inc. Common Stock,$28.98,0.16,0.555%,1623850946.00,United States,2020,55957,Health Care,Major Pharmaceuticals
KROS,Keros Therapeutics Inc. Common Stock,$62.45,1.90,3.138%,1447488020.00,United States,2020,145811,Health Care,Major Pharmaceuticals
KRP,Kimbell Royalty Partners Common Units Representing Limited Partner Interests,$10.02,0.02,0.20%,602023223.00,United States,2017,74348,Energy,Oil & Gas Production
KRTX,Karuna Therapeutics Inc. Common Stock,$121.06,-0.45,-0.37%,3245202880.00,United States,2019,97319,Health Care,Major Pharmaceuticals
KRUS,Kura Sushi USA Inc. Class A Common Stock,$26.20,-0.17,-0.645%,219338173.00,United States,2019,43203,Consumer Services,Restaurants
KRYS,Krystal Biotech Inc. Common Stock,$75.29,2.50,3.435%,1670057031.00,United States,2017,236094,Health Care,Biotechnology: Biological Products (No Diagnostic Substances)
KSM,DWS Strategic Municipal Income Trust,$11.91,-0.21,-1.733%,133438937.00,United States,1989,17718,,
KSMT,Kismet Acquisition One Corp Ordinary Shares,$10.08,0.00,0.00%,320040000.00,Russia,2020,1321361,Finance,Business Services
KSMTU,Kismet Acquisition One Corp Unit,$10.67,-0.06,-0.559%,0.00,Russia,2020,145364,Finance,Business Services
KSMTW,Kismet Acquisition One Corp Warrant,$1.21,-0.09,-6.923%,0.00,Russia,,108935,Finance,Business Services
KSPN,Kaspien Holdings Inc. Common Stock,$31.33,-1.55,-4.714%,59689853.00,United States,,5751,Consumer Services,Consumer Electronics/Video Chains
KSS,Kohl's Corporation Common Stock,$49.73,-0.63,-1.251%,7840053603.00,United States,1992,3419483,Consumer Services,Department/Specialty Retail Stores
KSU,Kansas City Southern Common Stock,$209.85,-1.29,-0.611%,19064420693.00,United States,,480343,Transportation,Railroads
KSU^,Kansas City Southern Preferred Stock,$39.00,-0.04,-0.102%,,United States,,50,Transportation,Railroads
KT,KT Corporation Common Stock,$11.68,-0.12,-1.017%,5554973988.00,South Korea,,1376333,Public Utilities,Telecommunications Equipment
KTB,Kontoor Brands Inc. Common Stock ,$42.85,0.09,0.21%,2451250105.00,,2019,202073,Consumer Non-Durables,Apparel
KTCC,Key Tronic Corporation Common Stock,$7.98,0.14,1.786%,85862246.00,United States,1983,75593,Technology,Electrical Products
KTF,DWS Municipal Income Trust,$11.60,-0.11,-0.939%,458210881.00,United States,1988,58653,,
KTH,Structures Products Cp 8% CorTS Issued by Peco Energy Cap Tr II Preferred Stock,$33.85,0.25,0.744%,0.00,United States,,1157,Finance,Finance: Consumer Services
KTN,Structured Products Corp 8.205% CorTS 8.205% Corporate Backed Trust Securities (CorTS),$32.65,-0.18,-0.548%,0.00,United States,,3300,Finance,Finance: Consumer Services
KTOS,Kratos Defense & Security Solutions Inc. Common Stock,$33.24,0.27,0.819%,4080413695.00,United States,,898699,Capital Goods,Military/Government/Technical
KTRA,Kintara Therapeutics Inc. Common Stock,$2.50,0.16,6.838%,76565045.00,United States,,1687308,Health Care,Major Pharmaceuticals
KUKE,Kuke Music Holding Limited American Depositary Shares each representing one Ordinary Share,$8.73,-0.21,-2.349%,258117492.00,,2021,34269,Consumer Services,Other Consumer Services
KURA,Kura Oncology Inc. Common Stock,$33.77,-0.23,-0.676%,2229988071.00,United States,,439000,Health Care,Major Pharmaceuticals
KVHI,KVH Industries Inc. Common Stock,$14.87,-0.32,-2.107%,272160539.00,United States,1996,89857,Technology,Radio And Television Broadcasting And Communications Equipment
KW,Kennedy-Wilson Holdings Inc. Common Stock,$17.66,-0.20,-1.12%,2502944701.00,United States,,248587,Finance,Real Estate
KWAC,Kingswood Acquisition Corp.,$10.30,10.30,,0.00,,,256240,,
KWR,Quaker Chemical Corporation Common Stock,$283.43,1.95,0.693%,5054003586.00,United States,,54665,Basic Industries,Major Chemicals
KXIN,Kaixin Auto Holdings Ordinary Share,$4.31,-0.18,-4.009%,280719562.00,China,2017,2559647,Consumer Durables,Automotive Aftermarket
KYMR,Kymera Therapeutics Inc. Common Stock,$59.21,-1.54,-2.535%,2632413897.00,United States,2020,204366,Health Care,Biotechnology: Biological Products (No Diagnostic Substances)
KYN,Kayne Anderson Energy Infrastructure Fund Inc.,$7.04,0.00,0.00%,890190780.00,United States,2004,492780,,
KZIA,Kazia Therapeutics Limited American Depositary Shares,$10.00,-0.36,-3.475%,94623360.00,Australia,,55589,Health Care,Major Pharmaceuticals
KZR,Kezar Life Sciences Inc. Common Stock,$5.96,-0.36,-5.696%,276544000.00,United States,2018,129184,Health Care,Major Pharmaceuticals
L,Loews Corporation Common Stock,$48.52,-0.25,-0.513%,12957098994.00,United States,,1052184,Finance,Property-Casualty Insurers
LABP,Landos Biopharma Inc. Common Stock,$14.35,0.56,4.061%,561991547.00,United States,2021,420047,Health Care,Major Pharmaceuticals
LAC,Lithium Americas Corp. Common Shares,$21.10,-1.38,-6.139%,2518784121.00,Canada,,5422073,Basic Industries,Precious Metals
LACQ,Leisure Acquisition Corp. Common Stock,$14.68,-0.6874,-4.473%,91372254.00,United States,2017,10777,Finance,Business Services
LACQU,Leisure Acquisition Corp. Unit,$16.90,0.00,0.00%,0.00,United States,2017,102,Finance,Business Services
LACQW,Leisure Acquisition Corp. Warrant,$1.5599,-0.04,-2.50%,0.00,United States,2017,53666,Finance,Business Services
LAD,Lithia Motors Inc. Common Stock,$371.33,-2.05,-0.549%,9849264977.00,United States,,196195,Consumer Durables,Automotive Aftermarket
LADR,Ladder Capital Corp Class A Common Stock,$10.53,-0.08,-0.754%,1308536322.00,,2014,853540,Consumer Services,Real Estate Investment Trusts
LAIX,LAIX Inc. American Depositary Shares each  representing one Class A Ordinary Share,$3.70,-0.07,-1.857%,182825262.00,,2018,985498,Consumer Services,Other Consumer Services
LAKE,Lakeland Industries Inc. Common Stock,$36.18,-0.83,-2.243%,290162876.00,United States,1986,333110,Health Care,Industrial Specialties
LAMR,Lamar Advertising Company Class A Common Stock,$84.99,-0.95,-1.105%,8571075939.00,United States,1996,375254,Consumer Services,Real Estate Investment Trusts
LANC,Lancaster Colony Corporation Common Stock,$179.50,-0.69,-0.383%,4945045500.00,United States,,48806,Consumer Non-Durables,Packaged Foods
LAND,Gladstone Land Corporation Common Stock,$18.95,0.40,2.156%,456740594.00,United States,2013,227046,Consumer Services,Real Estate Investment Trusts
LANDM,Gladstone Land Corporation 5.00% Series D Cumulative Term Preferred Stock,$25.9985,0.0485,0.187%,626626402.00,United States,,3537,Consumer Services,Real Estate Investment Trusts
LANDO,Gladstone Land Corporation 6.00% Series B Cumulative Redeemable Preferred Stock,$25.44,0.08,0.315%,0.00,United States,,12043,Consumer Services,Real Estate Investment Trusts
LARK,Landmark Bancorp Inc. Common Stock,$25.41,-0.13,-0.509%,120718794.00,United States,,3697,Finance,Major Banks
LASR,nLIGHT Inc. Common Stock,$40.85,-1.77,-4.153%,1608100732.00,United States,2018,638075,Technology,Semiconductors
LATN,Union Acquisition Corp. II Ordinary Shares,$10.51,0.01,0.095%,262750000.00,United States,2019,138095,Finance,Business Services
LATNU,Union Acquisition Corp. II Units containing one ordinary share and one redeemable warrant,$12.67,0.00,0.00%,0.00,United States,2019,56,Finance,Business Services
LATNW,Union Acquisition Corp. II Warrant,$1.30,0.07,5.691%,0.00,United States,2019,291445,Finance,Business Services
LAUR,Laureate Education Inc. Class A Common Stock,$14.40,-0.05,-0.346%,3025044331.00,United States,2017,418533,Consumer Services,Other Consumer Services
LAWS,Lawson Products Inc. Common Stock,$50.53,-0.92,-1.788%,456302423.00,United States,,10959,Consumer Durables,Industrial Specialties
LAZ,Lazard LTD. Lazard LTD. Class A Common Stock,$43.23,-0.08,-0.185%,4540531760.00,Bermuda,2005,625114,Finance,Investment Managers
LAZR,Luminar Technologies Inc.  Class A Common Stock,$34.05,-1.48,-4.165%,11030028972.00,United States,2019,4972776,Capital Goods,Auto Parts:O.E.M.
LAZRW,Luminar Technologies Inc. Warrant,$22.54,-1.51,-6.279%,0.00,United States,2019,91900,Capital Goods,Auto Parts:O.E.M.
LAZY,Lazydays Holdings Inc. Common Stock,$22.88,-0.38,-1.634%,216258351.00,United States,,245410,Consumer Durables,Automotive Aftermarket
LB,L Brands Inc.,$48.58,-0.63,-1.28%,13510513991.00,United States,,2941540,Consumer Services,Clothing/Shoe/Accessory Stores
LBAI,Lakeland Bancorp Inc. Common Stock,$15.10,0.14,0.936%,762242655.00,United States,,144192,Finance,Major Banks
LBC,Luther Burbank Corporation Common Stock,$10.42,0.20,1.957%,544135172.00,United States,2017,53418,Finance,Major Banks
LBRDA,Liberty Broadband Corporation Class A Common Stock,$147.83,0.18,0.122%,35463415156.00,United States,,44565,Consumer Services,Television Services
LBRDK,Liberty Broadband Corporation Class C Common Stock,$151.21,0.82,0.545%,36274254250.00,United States,,902601,Consumer Services,Television Services
LBRDP,Liberty Broadband Corporation Series A Cumulative Redeemable Preferred Stock,$28.10,-0.05,-0.178%,0.00,United States,,3807,Public Utilities,Telecommunications Equipment
LBRT,Liberty Oilfield Services Inc. Class A Common Stock,$10.91,-0.22,-1.977%,1958791819.00,United States,2018,1234694,Energy,Oilfield Services/Equipment
LBTYA,Liberty Global plc Class A Ordinary Shares,$26.17,-0.08,-0.305%,15259888129.00,United Kingdom,,2260653,,
LBTYB,Liberty Global plc Class B Ordinary Shares,$26.25,0.1799,0.69%,15306536621.00,United Kingdom,,813,Consumer Services,Television Services
LBTYK,Liberty Global plc Class C Ordinary Shares,$25.98,0.11,0.425%,15149097959.00,United Kingdom,,3596775,,
LC,LendingClub Corporation Common Stock,$12.35,-0.37,-2.909%,966173771.00,United States,2014,1006673,Finance,Finance: Consumer Services
LCAP,Lionheart Acquisition Corp. II Class A Common Stock,$10.45,-0.01,-0.096%,307230000.00,United States,2020,43000,Finance,Business Services
LCAPU,Lionheart Acquisition Corp. II Unit,$11.14,0.00,0.00%,0.00,United States,2020,16002,Finance,Business Services
LCAPW,Lionheart Acquisition Corp. II Warrant,$1.47,-0.0899,-5.763%,0.00,United States,2020,58020,Finance,Business Services
