Symbol,Name,Last Sale,Net Change,% Change,Market Cap,Country,IPO Year,Volume,Sector,Industry
CWCO,Consolidated Water Co. Ltd. Ordinary Shares,$13.07,-0.17,-1.284%,197657283.00,Cayman Islands,,72115,Public Utilities,Water Supply
CWEN,Clearway Energy Inc. Class C Common Stock,$31.65,-0.21,-0.659%,6381779084.00,United States,2015,762315,Public Utilities,Electric Utilities: Central
CWH,Camping World Holdings Inc. Class A Commom Stock,$38.25,0.51,1.351%,3394934366.00,United States,2016,1003959,Consumer Durables,Automotive Aftermarket
CWK,Cushman & Wakefield plc Ordinary Shares,$15.55,-0.42,-2.63%,3446339611.00,,2018,361185,Finance,Real Estate
CWST,Casella Waste Systems Inc. Class A Common Stock,$59.04,-0.10,-0.169%,2994664252.00,United States,1997,132492,Public Utilities,Environmental Services
CWT,California Water Service Group Common Stock,$58.33,0.22,0.379%,2907167200.00,United States,,87536,Public Utilities,Water Supply
CX,Cemex S.A.B. de C.V. Sponsored ADR,$6.41,-0.10,-1.536%,9683671189.00,Mexico,,11252677,Capital Goods,Building Materials
CXDC,China XD Plastics Company Limited Common Stock,$1.23,0.03,2.50%,86775074.00,China,,1746034,Capital Goods,Containers/Packaging
CXDO,Crexendo Inc. Common Stock,$6.39,-0.03,-0.467%,114785065.00,United States,,35742,Public Utilities,Telecommunications Equipment
CXE,MFS High Income Municipal Trust Common Stock,$5.07,-0.09,-1.744%,159814253.00,United States,1989,76862,,
CXH,MFS Investment Grade Municipal Trust Common Stock,$9.86,-0.13,-1.301%,89827016.00,United States,1989,39063,,
CXP,Columbia Property Trust Inc. Common Stock,$14.22,-0.03,-0.211%,1627692385.00,United States,2013,626426,Consumer Services,Real Estate Investment Trusts
CXW,CoreCivic Inc. Common Stock,$7.60,-0.02,-0.262%,909248800.00,United States,,1279703,Consumer Services,Real Estate Investment Trusts
CYAD,Celyad Oncology SA American Depositary Shares,$7.88,-0.39,-4.716%,111936629.00,Belgium,2015,21736,Health Care,Major Pharmaceuticals
CYAN,Cyanotech Corporation Common Stock,$3.68,-0.0176,-0.476%,22437229.00,United States,,5550,Consumer Durables,Specialty Chemicals
CYBE,CyberOptics Corporation Common Stock,$28.31,-0.36,-1.256%,205380104.00,United States,1987,106458,Capital Goods,Electronic Components
CYBR,CyberArk Software Ltd. Ordinary Shares,$152.89,1.05,0.692%,5921638395.00,Israel,2014,760165,Technology,Computer Software: Prepackaged Software
CYCC,Cyclacel Pharmaceuticals Inc. Common Stock,$8.95,-0.19,-2.079%,43532657.00,United States,,565731,Health Care,Major Pharmaceuticals
CYCCP,Cyclacel Pharmaceuticals Inc. 6% Convertible Preferred Stock,$8.00,0.00,0.00%,0.00,United States,,64,Health Care,Major Pharmaceuticals
CYCN,Cyclerion Therapeutics Inc. Common Stock,$4.61,0.03,0.655%,156564211.00,United States,,436553,Health Care,Major Pharmaceuticals
CYD,China Yuchai International Limited Common Stock,$17.45,0.05,0.287%,712977178.00,Singapore,1994,28197,Energy,Industrial Machinery/Components
CYH,Community Health Systems Inc. Common Stock,$9.24,0.04,0.435%,1105297596.00,United States,2000,1534419,Health Care,Hospital/Nursing Management
CYRN,CYREN Ltd. Ordinary Shares,$1.24,-0.10,-7.463%,75540184.00,United States,,5715316,Technology,Computer Software: Prepackaged Software
CYRX,CryoPort Inc. Common Stock,$66.85,-5.22,-7.243%,2958298610.00,United States,,609021,Health Care,Major Pharmaceuticals
CYTH,Cyclo Therapeutics Inc. Common Stock,$9.90,-0.80,-7.477%,45290777.00,United States,,466965,Basic Industries,Major Chemicals
CYTHW,Cyclo Therapeutics Inc. Warrant,$4.80,-0.64,-11.765%,0.00,United States,,12530,Basic Industries,Major Chemicals
CYTK,Cytokinetics Incorporated Common Stock,$21.86,0.96,4.593%,1547229443.00,United States,2004,475858,Health Care,Major Pharmaceuticals
CZNC,Citizens & Northern Corp Common Stock,$20.60,-0.13,-0.627%,327786870.00,United States,,27578,Finance,Major Banks
CZR,Caesars Entertainment Inc. Common Stock,$78.61,0.27,0.345%,16372665818.00,United States,,1930793,Consumer Services,Hotels/Resorts
CZWI,Citizens Community Bancorp Inc. Common Stock,$11.19,-0.01,-0.089%,123720545.00,United States,,6498,Finance,Savings Institutions
CZZ,Cosan Limited Class A Common Stock,$20.20,-0.64,-3.071%,4512999847.00,Brazil,,1534819,Consumer Non-Durables,Specialty Foods
D,Dominion Energy Inc. Common Stock,$72.39,1.26,1.771%,59057144287.00,United States,,3737018,Public Utilities,Electric Utilities: Central
DAC,Danaos Corporation Common Stock,$39.53,0.10,0.254%,808390121.00,Greece,2006,543815,Transportation,Marine Transportation
DADA,Dada Nexus Limited American Depositary Shares,$43.93,-1.25,-2.767%,10262361704.00,China,2020,994598,Technology,Computer Software: Programming Data Processing
DAIO,Data I/O Corporation Common Stock,$5.87,-0.02,-0.34%,49403886.00,United States,1981,45500,Capital Goods,Electrical Products
DAKT,Daktronics Inc. Common Stock,$5.44,-0.04,-0.73%,244617113.00,United States,1994,93726,Consumer Durables,Miscellaneous manufacturing industries
DAL,Delta Air Lines Inc. Common Stock,$44.39,-0.26,-0.582%,28327330459.00,United States,,10938240,Transportation,Air Freight/Delivery Services
DAN,Dana Incorporated Common Stock ,$22.81,0.18,0.795%,3295844546.00,United States,,1049295,Capital Goods,Auto Parts:O.E.M.
DAO,Youdao Inc. American Depositary Shares each representing one Class A Ordinary Share,$34.71,0.47,1.373%,4060408983.00,,2019,648946,Consumer Services,Other Consumer Services
DAR,Darling Ingredients Inc. Common Stock,$69.47,-0.74,-1.054%,11258897583.00,United States,,1092762,Consumer Non-Durables,Packaged Foods
DARE,Dare Bioscience Inc. Common Stock,$2.27,-0.03,-1.304%,94423494.00,United States,2014,1243229,Health Care,Major Pharmaceuticals
DASH,DoorDash Inc. Class A Common Stock,$197.87,-14.30,-6.74%,62854695810.00,,2020,2011253,Miscellaneous,Business Services
DAVA,Endava plc American Depositary Shares (each representing one Class A Ordinary Share),$83.41,-0.54,-0.643%,4597337746.00,,2018,147052,Technology,EDP Services
DB,Deutsche Bank AG Common Stock,$11.27,-0.08,-0.705%,23266612186.00,Germany,,2118328,Finance,Major Banks
DBD,Diebold Nixdorf Incorporated Common Stock,$14.01,0.05,0.358%,1088274706.00,United States,,1068119,Miscellaneous,Office Equipment/Supplies/Services
DBDR,Roman DBDR Tech Acquisition Corp. Class A Common Stock,$10.45,0.11,1.064%,302475250.00,United States,2020,29567,Finance,Business Services
DBDRU,Roman DBDR Tech Acquisition Corp. Unit,$10.93,0.00,0.00%,0.00,United States,2020,37,Finance,Business Services
DBDRW,Roman DBDR Tech Acquisition Corp. Warrant,$1.44,0.08,5.882%,0.00,United States,2020,155544,Finance,Business Services
DBI,Designer Brands Inc. Class A Common Stock,$12.69,0.05,0.396%,918665609.00,United States,,1103682,Consumer Services,Clothing/Shoe/Accessory Stores
DBL,DoubleLine Opportunistic Credit Fund Common Shares of Beneficial Interest,$19.61,-0.02,-0.102%,293304731.00,United States,2012,35159,,
DBTX,Decibel Therapeutics Inc. Common Stock,$18.50,0.40,2.21%,449579175.00,United States,2021,122798,Health Care,Major Pharmaceuticals
DBVT,DBV Technologies S.A. American Depositary Shares,$5.81,-0.10,-1.692%,637742633.00,France,2014,159766,Health Care,Biotechnology: Biological Products (No Diagnostic Substances)
DBX,Dropbox Inc. Class A Common Stock,$24.10,-0.39,-1.592%,9968175436.00,United States,2018,5381283,Technology,Computer Software: Prepackaged Software
DCBO,Docebo Inc. Common Shares,$52.09,-2.38,-4.369%,1702791784.00,Canada,,90826,Technology,Computer Software: Prepackaged Software
DCF,BNY Mellon Alcentra Global Credit Income 2024 Target Term Fund Inc. Common Stock,$8.92,-0.06,-0.668%,133471137.00,,2017,40496,,
DCI,Donaldson Company Inc. Common Stock,$60.33,-0.69,-1.131%,7616054313.00,United States,,297500,Capital Goods,Pollution Control Equipment
DCO,Ducommun Incorporated Common Stock,$55.51,-0.55,-0.981%,652990109.00,United States,,32916,Capital Goods,Military/Government/Technical
DCOM,Dime Community Bancshares Inc. Common Stock,$27.69,0.66,2.442%,915095299.00,United States,,130577,Finance,Savings Institutions
DCOMP,Dime Community Bancshares Inc. Fixed-Rate Non-Cumulative Perpetual Preferred Stock Series A,$25.20,0.04,0.159%,0.00,United States,,16609,Finance,Savings Institutions
DCP,DCP Midstream  LP Common Units ,$22.15,-0.02,-0.09%,4614986345.00,United States,,918033,Public Utilities,Natural Gas Distribution
DCP^B,DCP Midstream LP 7.875% Series B Fixed-to-Floating Rate Cumulative Redeemable Perpetual Preferred Units,$22.50,0.44,1.995%,,United States,,6060,,
DCP^C,DCP Midstream LP 7.95% Series C Fixed-to-Floating Rate Cumulative Redeemable Perpetual Preferred Units,$22.52,0.33,1.487%,,United States,,5777,,
DCPH,Deciphera Pharmaceuticals Inc. Common Stock,$46.40,-1.39,-2.909%,2673843755.00,United States,2017,533436,Health Care,Major Pharmaceuticals
DCRB,Decarbonization Plus Acquisition Corporation Class A Common Stock,$15.10,-0.65,-4.127%,426055968.00,United States,2020,1732702,Finance,Business Services
DCRBU,Decarbonization Plus Acquisition Corporation Unit,$17.045,-0.715,-4.026%,0.00,United States,2020,101832,Finance,Business Services
DCRBW,Decarbonization Plus Acquisition Corporation Warrant,$3.89,-0.31,-7.381%,0.00,United States,2020,383843,Finance,Business Services
DCRNU,Decarbonization Plus Acquisition Corporation II Unit,$11.37,0.02,0.176%,0.00,United States,2021,119333,Finance,Business Services
DCT,Duck Creek Technologies Inc. Common Stock,$57.83,-0.47,-0.806%,7577156782.00,United States,2020,524932,Technology,Computer Software: Prepackaged Software
DCTH,Delcath Systems Inc. Common Stock,$21.58,-2.08,-8.791%,125073040.00,United States,,117751,Health Care,Medical/Dental Instruments
DCUE,Dominion Energy Inc. 2019 Series A Corporate Units,$98.69,1.64,1.69%,0.00,United States,2019,30260,Public Utilities,Electric Utilities: Central
DD,DuPont de Nemours Inc. Common Stock,$69.99,-1.00,-1.409%,37660850090.00,,2017,6065488,Basic Industries,Major Chemicals
DDD,3D Systems Corporation Common Stock,$45.07,-2.78,-5.81%,5595077010.00,United States,,5036171,Technology,Computer Software: Prepackaged Software
DDF,Delaware Investments Dividend & Income Fund Inc. Common Stock,$9.67,-0.01,-0.103%,73599908.00,United States,1993,11540,,
DDMX,DD3 Acquisition Corp. II Class A Common Stock,$10.70,0.35,3.382%,77288240.00,Mexico,2021,298498,Finance,Business Services
DDMXU,DD3 Acquisition Corp. II Unit,$11.337,0.137,1.223%,0.00,Mexico,2020,39454,Finance,Business Services
DDMXW,DD3 Acquisition Corp. II Warrant,$2.19,0.115,5.542%,0.00,Mexico,2021,280416,Finance,Business Services
DDOG,Datadog Inc. Class A Common Stock,$103.08,-4.48,-4.165%,31391194535.00,United States,2019,5524000,Technology,Computer Software: Prepackaged Software
DDS,Dillard's Inc. Common Stock,$77.52,-2.02,-2.54%,1705276588.00,United States,,470366,Consumer Services,Department/Specialty Retail Stores
DDT,Dillard's Capital Trust I,$25.42,-0.05,-0.196%,0.00,United States,,9837,Consumer Services,Department/Specialty Retail Stores
DE,Deere & Company Common Stock,$312.08,-5.01,-1.58%,98124613036.00,United States,,2009150,Capital Goods,Industrial Machinery/Components
DEA,Easterly Government Properties Inc. Common Stock,$21.87,-0.21,-0.951%,1776529953.00,United States,2015,700150,Consumer Services,Real Estate Investment Trusts
DECK,Deckers Outdoor Corporation Common Stock,$323.66,-0.15,-0.046%,9117476307.00,United States,1993,276008,Consumer Non-Durables,Shoe Manufacturing
DEH,D8 Holdings Corp. Class A Ordinary Shares,$10.45,0.00,0.00%,450656250.00,Hong Kong,2020,158552,Finance,Business Services
DEI,Douglas Emmett Inc. Common Stock,$29.05,-0.28,-0.955%,5094640438.00,United States,2006,996359,Consumer Services,Real Estate Investment Trusts
DELL,Dell Technologies Inc. Class C Common Stock ,$79.26,-0.18,-0.227%,59429495000.00,,2018,1821493,Technology,Computer Manufacturing
DEN,Denbury Inc. Common Stock,$38.76,0.84,2.215%,1937999961.00,,2020,845878,Energy,Oil & Gas Production
DENN,Denny's Corporation Common Stock,$16.29,-0.14,-0.852%,1038782675.00,United States,,947661,Consumer Services,Restaurants
DEO,Diageo plc Common Stock,$169.25,-0.26,-0.153%,98998986822.00,United Kingdom,,246884,Consumer Non-Durables,Beverages (Production/Distribution)
DESP,Despegar.com Corp. Ordinary Shares,$13.53,0.71,5.538%,946369380.00,,2017,539110,Consumer Services,Transportation Services
DEX,Delaware Enhanced Global Dividend Common Shares of Beneficial Interest,$9.86,-0.01,-0.101%,117319200.00,United States,2007,23139,,
DFFN,Diffusion Pharmaceuticals Inc. Common Stock,$1.49,-0.21,-12.353%,95383007.00,United States,,32366426,Health Care,Major Pharmaceuticals
DFH,Dream Finders Homes Inc. Class A Common Stock,$26.14,1.24,4.98%,2418511539.00,United States,2021,229673,Capital Goods,Homebuilding
DFHT,Deerfield Healthcare Technology Acquisitions Corp. Class A Common Stock,$14.01,-0.49,-3.379%,251742188.00,United States,2020,18470,Health Care,Hospital/Nursing Management
DFHTU,Deerfield Healthcare Technology Acquisitions Corp. Unit,$14.08,-0.46,-3.164%,0.00,United States,2020,2513,Health Care,Hospital/Nursing Management
DFHTW,Deerfield Healthcare Technology Acquisitions Corp. Warrant,$3.44,-0.06,-1.714%,0.00,United States,2020,261,Health Care,Hospital/Nursing Management
DFIN,Donnelley Financial Solutions Inc. Common Stock ,$22.24,-0.26,-1.156%,742268229.00,,2016,523250,Consumer Services,Other Consumer Services
DFNS,LGL Systems Acquisition Corp. Common Stock,$10.71,-0.01,-0.093%,230934375.00,United States,2020,115319,Finance,Business Services
DFP,Flaherty & Crumrine Dynamic Preferred and Income Fund Inc. Common Stock,$30.18,0.21,0.701%,578603687.00,,2013,44693,,
DFPH,DFP Healthcare Acquisitions Corp. Class A Common Stock,$10.995,0.035,0.319%,316106250.00,United States,2020,33162,Finance,Business Services
DFPHU,DFP Healthcare Acquisitions Corp. Unit,$11.55,0.05,0.435%,0.00,United States,2020,20160,Finance,Business Services
DFPHW,DFP Healthcare Acquisitions Corp. Warrant,$2.00,-0.25,-11.111%,0.00,United States,2020,7715,Finance,Business Services
DFS,Discover Financial Services Common Stock,$91.70,-4.20,-4.38%,28151900000.00,United States,,3730954,Finance,Finance: Consumer Services
DG,Dollar General Corporation Common Stock,$201.50,1.27,0.634%,49367681955.00,United States,2009,1453825,Consumer Services,Department/Specialty Retail Stores
DGICA,Donegal Group Inc. Class A Common Stock,$13.89,0.16,1.165%,413532594.00,United States,,51719,Finance,Property-Casualty Insurers
DGICB,Donegal Group Inc. Class B Common Stock,$12.10,0.00,0.00%,360240777.00,United States,1986,74,Finance,Property-Casualty Insurers
DGII,Digi International Inc. Common Stock,$23.66,-0.33,-1.376%,702922180.00,United States,1989,73708,Technology,Computer Communications Equipment
DGLY,Digital Ally Inc. Common Stock,$2.52,0.00,0.00%,101987401.00,United States,,8778958,Technology,Radio And Television Broadcasting And Communications Equipment
DGNR,Dragoneer Growth Opportunities Corp. Class A Ordinary Shares,$12.00,0.19,1.609%,1035000000.00,United States,2020,1696418,Finance,Business Services
DGNS,Dragoneer Growth Opportunities Corp. II Class A Ordinary Shares,$12.65,-0.05,-0.394%,399487000.00,United States,2020,86502,Finance,Business Services
DGX,Quest Diagnostics Incorporated Common Stock,$121.85,-0.23,-0.188%,16206050000.00,United States,,1220122,Health Care,Medical Specialities
DHC,Diversified Healthcare Trust Common Shares of Beneficial Interest,$4.355,-0.10,-2.245%,1037659222.00,United States,,935654,Consumer Services,Real Estate Investment Trusts
DHCNI,Diversified Healthcare Trust 5.625% Senior Notes due 2042,$23.01,0.19,0.833%,0.00,United States,,20916,Consumer Services,Real Estate Investment Trusts
DHCNL,Diversified Healthcare Trust 6.25% Senior Notes Due 2046,$23.58,0.16,0.683%,0.00,United States,,24404,Consumer Services,Real Estate Investment Trusts
DHF,BNY Mellon High Yield Strategies Fund Common Stock,$3.07,0.03,0.987%,223212602.00,United States,1998,2088134,,
DHHCU,DiamondHead Holdings Corp. Unit,$10.70,-0.20,-1.835%,0.00,United States,2021,130582,Finance,Business Services
DHI,D.R. Horton Inc. Common Stock,$78.39,-0.57,-0.722%,28510577204.00,United States,,3055198,Capital Goods,Homebuilding
DHIL,Diamond Hill Investment Group Inc. Class A Common Stock,$142.90,0.55,0.386%,452030711.00,United States,,5096,Finance,Investment Managers
DHR,Danaher Corporation Common Stock,$239.91,-2.36,-0.974%,170576010000.00,United States,,1951805,Capital Goods,Industrial Machinery/Components
DHR^A,Danaher Corporation 4.75% Mandatory Convertible Preferred Stock Series A,$1650.87,0.00,0.00%,,United States,,9903,,
DHR^B,Danaher Corporation 5.00% Mandatory Convertible Preferred Stock Series B,$1374.15,-16.19,-1.164%,,United States,,3027,,
DHT,DHT Holdings Inc.,$5.96,-0.27,-4.334%,1017958035.00,Jersey,2005,4158187,Transportation,Marine Transportation
DHX,DHI Group Inc. Common Stock,$2.90,-0.04,-1.361%,151496467.00,United States,2007,86731,Miscellaneous,Business Services
DIAX,Nuveen Dow 30SM Dynamic Overwrite Fund Common Shares of Beneficial Interest,$15.27,0.11,0.726%,555322762.00,,2014,83332,,
DIN,Dine Brands Global Inc. Common Stock,$72.83,-1.79,-2.399%,1195777490.00,United States,,414317,Consumer Services,Restaurants
DIOD,Diodes Incorporated Common Stock,$81.94,0.16,0.196%,4264318448.00,United States,,469993,Technology,Semiconductors
DIS,Walt Disney Company (The) Common Stock,$186.44,0.09,0.048%,338437801330.00,United States,,11396864,Consumer Services,Services-Misc. Amusement & Recreation
DISCA,Discovery Inc. Series A Common Stock,$49.36,2.01,4.245%,24243278614.00,United States,,4604315,Consumer Services,Television Services
DISCB,Discovery Inc. Series B Common Stock,$49.60,-0.40,-0.80%,24361155171.00,United States,,1155,Consumer Services,Television Services
DISCK,Discovery Inc. Series C Common Stock,$41.62,1.12,2.765%,20441759642.00,United States,,3875305,Consumer Services,Television Services
DISH,DISH Network Corporation Class A Common Stock,$32.50,0.245,0.76%,17095275178.00,United States,1995,2897088,Consumer Services,Television Services
DJCO,Daily Journal Corp. (S.C.) Common Stock,$345.00,17.00,5.183%,476357370.00,United States,,2569,Consumer Services,Newspapers/Magazines
DK,Delek US Holdings Inc. Common Stock,$23.19,-0.09,-0.387%,1709700328.00,United States,2017,984807,Energy,Integrated oil Companies
DKL,Delek Logistics Partners L.P. Common Units representing Limited Partner Interests,$41.41,0.71,1.744%,1798570427.00,United States,2012,90632,Energy,Natural Gas Distribution
DKNG,DraftKings Inc. Class A Common Stock,$58.86,-1.64,-2.711%,23056275798.00,United States,2019,9073059,Consumer Services,Services-Misc. Amusement & Recreation
DKS,Dick's Sporting Goods Inc Common Stock,$72.76,-1.22,-1.649%,6519199593.00,United States,2002,1613787,Consumer Services,Other Specialty Stores
DL,China Distance Education Holdings Limited American Depositary Shares,$9.69,0.04,0.415%,327813747.00,China,,42677,Consumer Services,Other Consumer Services
DLB,Dolby Laboratories Common Stock,$94.50,-0.35,-0.369%,9602425004.00,United States,2005,348419,Miscellaneous,Multi-Sector Companies
DLCAU,Deep Lake Capital Acquisition Corp. Unit,$10.70,-0.10,-0.926%,0.00,United States,2021,76786,Finance,Business Services
DLHC,DLH Holdings Corp.,$10.74,-0.14,-1.287%,134721550.00,United States,,15459,Technology,Professional Services
DLNG,Dynagas LNG Partners LP Common Units,$3.08,-0.10,-3.145%,109686746.00,Greece,,129773,Consumer Services,Marine Transportation
DLNG^A,Dynagas LNG Partners LP 9.00% Series A Cumulative Redeemable Preferred Units,$24.57,-0.03,-0.122%,,Greece,,12375,,
DLNG^B,Dynagas LNG Partners LP 8.75% Series B Fixed to Floating Rate Cumulative Redeemable Perpetual Preferred Units liquidation preference $25.00 per Uni,$21.2088,0.2088,0.994%,,Greece,,7103,,
DLPN,Dolphin Entertainment Inc. Common Stock,$5.16,0.34,7.054%,33851365.00,United States,,583849,Consumer Services,Other Consumer Services
DLR,Digital Realty Trust Inc. Common Stock,$138.28,1.08,0.787%,38758463311.00,United States,2004,1203138,Consumer Services,Real Estate Investment Trusts
DLR^C,Digital Realty Trust Inc. 6.625% Series C Cumulative Redeemable Perpetual Preferred Stock,$25.658,0.038,0.148%,,United States,,13409,,
DLR^J,Digital Realty Trust Inc. 5.250% Series J Cumulative Redeemable Preferred Stock,$26.0607,0.1807,0.698%,,United States,,17480,,
DLR^K,Digital Realty Trust Inc. 5.850% Series K Cumulative Redeemable Preferred Stock par value $0.01 per share,$27.12,0.06,0.222%,,United States,,10905,,
DLR^L,Digital Realty Trust Inc. 5.200% Series L Cumulative Redeemable Preferred Stock,$26.65,0.13,0.49%,,United States,,17295,,
DLTH,Duluth Holdings Inc. Class B Common Stock,$13.36,-0.71,-5.046%,438584699.00,United States,2015,193680,Consumer Services,Clothing/Shoe/Accessory Stores
DLTR,Dollar Tree Inc. Common Stock,$108.32,0.67,0.622%,25476013905.00,United States,1995,1284112,Consumer Services,Department/Specialty Retail Stores
DLX,Deluxe Corporation Common Stock,$38.82,-0.10,-0.257%,1626324614.00,United States,,163895,Consumer Durables,Publishing
DLY,DoubleLine Yield Opportunities Fund Common Shares of Beneficial Interest,$19.60,0.045,0.23%,0.00,,2020,100059,,
DM,Desktop Metal Inc. Class A Common Stock,$29.13,-2.61,-8.223%,6603916097.00,,2019,4229929,Technology,Industrial Machinery/Components
DMAC,DiaMedica Therapeutics Inc. Common Stock,$10.42,1.02,10.851%,195261151.00,United States,2018,553470,Health Care,Major Pharmaceuticals
DMB,BNY Mellon Municipal Bond Infrastructure Fund Inc. Common Stock,$14.55,-0.10,-0.683%,267539187.00,,2013,16775,,
DMLP,Dorchester Minerals L.P. Common Units Representing Limited Partnership Interests,$14.16,-0.13,-0.91%,491065600.00,United States,,62156,Energy,Oil & Gas Production
DMO,Western Asset Mortgage Opportunity Fund Inc. Common Stock,$14.70,0.25,1.73%,161465947.00,United States,2010,68439,,
DMRC,Digimarc Corporation Common Stock,$44.03,0.24,0.548%,727103671.00,United States,,58921,Technology,EDP Services
DMS,Digital Media Solutions Inc. Class A Ordinary Shares,$14.14,0.03,0.213%,825663460.00,United States,2018,199770,Miscellaneous,Business Services
DMTK,DermTech Inc. Common Stock,$69.46,-6.19,-8.182%,1765671741.00,United States,2017,1679673,Health Care,Medical Specialities
DMYD,dMY Technology Group Inc. II Class A Common Stock,$19.16,0.74,4.017%,661020000.00,United States,2020,784434,Finance,Business Services
DMYI,dMY Technology Group Inc. III Class A Common Stock,$11.81,0.11,0.94%,447672813.00,United States,2021,167537,Finance,Business Services
DNB,Dun & Bradstreet Holdings Inc. Common Stock,$23.86,0.10,0.421%,10091640160.00,United States,2020,1381964,Finance,Finance: Consumer Services
DNK,Phoenix Tree Holdings Limited American Depositary Shares each representing ten (10) Class A ordinary shares,$3.03,-0.09,-2.885%,554126400.00,,2020,207889,Consumer Services,Building operators
DNLI,Denali Therapeutics Inc. Common Stock,$62.81,-0.63,-0.993%,7532080734.00,United States,2017,867193,Health Care,Biotechnology: Biological Products (No Diagnostic Substances)
DNMR,Danimer Scientific Inc. Common Stock,$46.03,-6.95,-13.118%,3945901957.00,,2020,6276466,Basic Industries,Major Chemicals
DNOW,NOW Inc. Common Stock,$10.41,-0.38,-3.522%,1138641917.00,,2014,1484838,Energy,Metal Fabrications
DNP,DNP Select Income Fund Inc. Common Stock,$10.38,0.03,0.29%,3210560459.00,United States,1987,532701,,
DOC,Physicians Realty Trust Common Shares of Beneficial Interest,$17.80,-0.27,-1.494%,3706489586.00,United States,2013,1467522,Consumer Services,Real Estate Investment Trusts
DOCU,DocuSign Inc. Common Stock,$254.98,-9.71,-3.668%,48766688952.00,United States,2018,2374617,Technology,Computer Software: Prepackaged Software
DOGZ,Dogness (International) Corporation Class A Common Stock,$2.88,0.65,29.148%,84582032.00,China,2017,104223518,Consumer Durables,Miscellaneous manufacturing industries
DOMO,Domo Inc. Class B Common Stock,$67.27,-2.76,-3.941%,2014687191.00,United States,2018,246942,Technology,Computer Software: Prepackaged Software
DOOO,BRP Inc. (Recreational Products) Common Subordinate Voting Shares,$72.50,-3.28,-4.328%,6374209425.00,Canada,,75910,Capital Goods,Industrial Specialties
DOOR,Masonite International Corporation Ordinary Shares (Canada),$105.23,0.35,0.334%,2578447217.00,Canada,,192037,Basic Industries,Forest Products
DORM,Dorman Products Inc. Common Stock,$94.58,-1.05,-1.098%,3053675802.00,United States,,163494,Capital Goods,Auto Parts:O.E.M.
DOV,Dover Corporation Common Stock,$120.63,-1.02,-0.838%,17328408666.00,United States,,615254,Technology,Industrial Machinery/Components
DOW,Dow Inc. Common Stock ,$58.54,-0.21,-0.357%,43548758342.00,,2019,3277664,Basic Industries,Major Chemicals
DOX,Amdocs Limited Ordinary Shares,$78.26,0.19,0.243%,10260682843.00,Guernsey,,1469676,Technology,EDP Services
DOYU,DouYu International Holdings Limited ADS,$17.13,-2.05,-10.688%,5497814402.00,China,2019,5809401,Technology,Computer Software: Programming Data Processing
DPG,Duff & Phelps Utility and Infrastructure Fund Inc.,$13.27,-0.09,-0.674%,503328526.00,United States,2011,135693,,
DPZ,Domino's Pizza Inc Common Stock,$376.49,-1.43,-0.378%,14833670610.00,United States,2004,534278,Consumer Non-Durables,Food Distributors
DQ,DAQO New Energy Corp. American Depositary Shares each representing five ordinary shares,$112.51,-7.71,-6.413%,7817625713.00,China,2010,2853356,Technology,Semiconductors
DRD,DRDGOLD Limited American Depositary Shares,$9.64,-0.33,-3.31%,824329694.00,South Africa,,485076,Basic Industries,Precious Metals
DRE,Duke Realty Corporation Common Stock,$41.22,-0.17,-0.411%,15331827269.00,United States,,1217808,Consumer Services,Real Estate Investment Trusts
DRH,Diamondrock Hospitality Company Common Stock,$9.57,0.10,1.056%,1909395682.00,United States,2005,1522899,Consumer Services,Real Estate Investment Trusts
DRH^A,Diamondrock Hospitality Company 8.250% Series A Cumulative Redeemable Preferred Stock,$26.99,0.04,0.148%,,United States,,396,,
